Unnamed: 0,GENERAL,Unnamed: 2,General Notes ,Unnamed: 4,Unnamed: 5,Unnamed: 6,GSP Information,Answer,Unnamed: 9,Unnamed: 10,Unnamed: 11,Unnamed: 12
Martha,,,Ecosystems,2,"Does the Stakeholder Communication and Engagement Plan or GSP include outreach to environmental stakeholders during GSP implementation? If so, please describe the level of engagement in the Notes. Answer according to level of engagement: Yes = Involve, Collaborate, Empower; Somewhat = Inform and Consult; No = No mention of engagement.","No=does not identify environmental users as stakeholders, does not outline outreach methods 
Somewhat=identifies environmental stakeholders, outlines only general stakeholder outreach, not specific to environmental stakeholders
Yes=Identifies environmental stakeholders, includes outreach material for env stakeholders specifically beyond informing","environment, stakeholder, environmental beneficial user",No,"Outreach Strategies, Forums and Tools SGMA gives local GSAs wide discretion in how to conduct stakeholder communication and engagement. The Siskiyou County GSA will utilize the following outreach strategies, forums and tools to successfully meet all SGMA stakeholder engagement  requirements:  Public Meetings and Workshops: Public meetings and workshops will be held as needed at key milestones or as required by SGMA. These events can target specific geographic areas or be designed to welcome constituents from across the basin. At times, public meetings may be held in different locations across Siskiyou County. GSA staff, as well as the GSA’s technical and facilitation consultants, will help plan and facilitate these events. Advisory Committee members and the District Board may play a support role. 

Advisory Committee Meeting Announcements: Meeting agendas and handouts will be distributed to committee members and the interested parties list 72 hours prior to each meeting. Social Media: Although not currently used, Facebook, Twitter, YouTube and other emerging social media technologies may be utilized to provide SGMA updates to interested parties. Informational Materials: GSA staff, with support from both its consultants and Advisory Committee members, will jointly develop and utilize an array of informational materials to educate the public. These materials may include, but not necessarily be limited to, the following: • Local SGMA brochures and key talking points • Frequently asked questions about SGMA, the local GSA and the local GSP • Existing and new educational materials • Publicly available groundwater elevation or other related data • Press releases, newspaper editorials and newsletter articles Website: The GSA will regularly post and archive SGMA affiliated meeting materials on the county’s established SGMA website (e.g. meeting agendas, presentations, summaries). The website will also serve as a repository for groundwater related reports, studies and other topical information discussed by the GSA or its Advisory Committees. Media: Production of public service announcements, press releases or featured articles will expand awareness of SGMA and how interested parties can get involved. At important milestones advertisements or other announcements in local newspapers will provide information about public meetings, workshops and public comment periods on draft GSP materials.


Interested Parties List: GSA staff will maintain a interested parties email list that includes anyone interested in receiving information on SGMA in Siskiyou County during GSP development and implementation. Notification for public meetings and comment periods on draft  GSP materials will be distributed through the interested parties list.",,"1. Documents outreach plans to stakeholders? (yes/no)
2. List specific outreach methods for Environmental stakeholders?  (yes/no)
3. What level of outreach engagement? 

GSP lists Environmental/Ecosystem users as stakeholders, it mostly focuses on outreach and engagement during development. There are no targetted outreach for environmental stakeholders. ",
Martha,,,All,2,Does the GSP include a Stakeholder Communication and Engagement Plan?,"No= does not include a C&E plan
Yes= includes specific section in GSP  dedicated to Stakeholder C&E
","Stakeholder community and engagement plan, beneficial user",Yes,,Appendix 1-A Shasta Valley Communications & Engagement Plan,Appendix 1-A serves as the Communication and Engagement Plan for the Shasta Valley Basin. ,
Martha,,,DACs,1,"Does the GSP identify each DAC by name and location on a map? Please indicate in the Notes whether DAC places, tracks, or block data were used.","No= does not identify DACs by name, does not identify DAC locations on a map
Somewhat=identifies DAC location on a map or DAC by name (one or the other, not both)
Yes=Identifies DAC location on a map and identifies them by name(re: DAC name-- in text or map))","Disadvantaged Communit*, DAC",Somewhat,"The Valley also is home to the census-designated places (CDP) of Grenada (367), Carrick (131), Gazelle (70), and Edgewood (43). Communities in theValley categorized as either disadvantaged or severely disadvantaged include: Gazelle, Grenada, Montague, Weed, and Yreka. Communities with an annual median household income (MHI) of less than 80% of the average annual MHI in California are classified as Disadvantaged Communities (DACs), while communities with annual MHIs of less than 60% of California’s average annual MHI are considered Severely Disadvantaged Communities (SDACs). Based on the 2012-2016 DAC Mapping Tool, the statewide average annual MHI is $63,783 and Gazelle, Grenada, Weed, and Yreka all qualify as SDACs with annual MHIs of $31,389, $29,773, $29,427, and $30,202, respectively (DWR 2019a). Montague has an annual MHI of $41,923, which qualifies it as a DAC. Carrick and Edgewood are not listed in the government database as either a DAC or SDAC as no MHI data is provided for either CDP (DWR 2019a).",2021-02-02 00:00:00,"1. Location on the map? (yes/no) No
2. Identified by name? (yes/no) Yes
3. DAC places, tracks, or block data used in map? NA

The GSP references DAC locations in the text but does not actually map them. ",
Martha,,,Tribes,1,Are tribal lands identified and mapped in the basin?,"No=does not identify Tribal lands on a map, or references in the text
Somewhat=Tribal lands are identified in text but not mapped OR Tribal lands are mapped but not identified in text
Yes=Tribal lands are identified in text and mapped","tribal, tribe",Yes,,"Figure 1: Shasta Valley Bulletin 118 Basin Boundary (black) and watershed boundary (light blue).
Page 2-1","1. Tribal lands identified? (yes/no) YES
2. Tribal lands mapped? (yes/no) YES

Figure 1 of Section 2 includes a map showing the boundaries of the Basin, this same map highlights the area in which the Karuk Tribe is located, highligheted in purple color. ",
Martha,,,DACs,2,Does the GSP describe the size of the population in each DAC?,"No=no reference to DAC population
Somewhat= Includes a population map and references DAC seperately
Yes= DAC population is explicitly mentioned or mapped","Disadvantaged Communit*, DAC, population",No,,,"1. Does the GSP document the size of the population for each DAC?
No mention of DAC population or population density.",
Martha,,,DACs,2,Does the GSP map the location of all domestic wells by location and by depth?,"No= no map and no reference of well depth, depth range of domestic wells in text; 
Map of domestic wells (point or density map of DOMESTIC wells) but no depth details in map or text
Somewhat= no map but range of depths and reference to number of domestic wells
Yes= map with DOMESTIC depths (density points or data, either in text or in map)",domestic well,No,"The primary uses of the wells reviewed were: Domestic Wells: 3,264","2-8
Figure 4, Page 2-11 (Well Desntiy Map)","1. Does the map include depth by location? No
The GSP states the number of domestic wells in the basin, and includes a well density map shown as Figure 4 in Section 2. ",
Martha,,,DACs,2,Does the GSP map the density of domestic wells in the basin?,"No= no map of domestic wells, reference of domestic well density in text but no map provided, or no reference at all 
Yes= density map of Domestic wells
 ",domestic well,Yes,"The density of groundwater wells is highest in the south and northwest sections of the Basin,  especially near the cities of M

Figure 4: Well density maps indicating number of domestic (panel A)","Figure 4, Page 2-11","1. How are domestic wells mapped (density/point/none)? Density

On Figure 4, Panel A shows the density of domestic groundwater wells in the plan area. ",
Sara,,,All,,"In the Basin Setting (Groundwater Conditions - Water Quality) section of the GSP, are water quality contaminants or constituents of concern (e.g., Nitrates; Arsenic, Uranium; DBCP; 1,2,3-TCP; Chromium-6; Perchlorate; Particulate Organic Carbon (POC); Brackish water (TDS; salts)) identified and mapped (distribution or contaminant plumes) within the plan area? In the Notes, please specify which contaminants or constituents of concern are present in the basin, and whether (distribution or contaminent plume) maps and trends were provided for each. Answer Yes =  contaminants are identified, mapped, and spatial trends described in the text; Somewhat = contaminants are identified and/or mapped, but not all spatial trends of contaminants are provided; No = No contaminants are / are not identified and mapped, and no spatial trends of contaminants are provided.","no = no water quality evaluation, no mapping spatially or description of temporal trends 
somewhat = Only come COCs mapped/trends describe, don't mention data for non-COCs
 yes = COC's have been clearly stated, mapped and temporal trends described, reason for high COC's have been stated","Nitrate; Arsenic, Uranium; DBCP; 1,2,3-TCP; Chromium-6; Perchlorate; Particulate Organic Carbon (POC); Brackish water; constituents of concern (COC); water quality; Contaminants",Yes,"Previous work has characterized groundwater in the Basin as calcium magnesium bicarbonate type (DWR 2004). Within Shasta Valley, groundwater quality issues have historically been localized and attributed to natural sources. Elevated constituents have included: boron, calcium, chloride, conductivity, magnesium, iron, fluoride, nitrate, sodium, sulfate and hardness. Total dissolved solids in the Basin have historically been within the range of 131 mg/L to 1,240 mg/L with locally elevated levels (DWR 2004). Groundwater quality has been noted to be closely connected to local geology, in particular high magnesium has been attributed to serpentine and elevated calcium has been attributed to the presence of limestone (Mack 1960). Identified localized groundwater quality issues include Table Rock Springs with high sodium, chloride and boron, areas near Willow Creek and Julian Creek with elevated boron, dissolved solids and sodium, near Montague, Grenada and Big Springs and near Oregon Slough and Little Shasta River (DWR 2004; Gwynne 1993). Groundwater in the Basin is generally of good quality and meets local needs for municipal, domestic, and agricultural uses. Ongoing monitoring programs show that some constituents, including arsenic, boron, iron, manganese, and benzene, in addition to pH and specific conductivity, exceed water quality standards in parts of the Basin. Exceedances may be caused by localized conditions and may not be reflective of regional water quality. In addition, there are potential risks of increasing salt and nutrient conditions from agricultural and municipal uses of water.

A summary of information and methods used to assess current groundwater quality in the Basin as well as key findings, are presented below. A detailed description of information, methods, and all findings of the assessment can be found in Appendix 2-B – Water Quality Assessment.","Figure 1 thru Figure 47 Appendix 2b
pg 93, 2.2.2.3","1. Are all concerning constituents identified as COC's, Yes/No -->which ones? Yes: Arsenic, Boron, Benzene, Iron, Manganese, Nitrate, pH, Specific Conductivity
2. Are the COC's mapped? Yes
3. Is there spatial trend data for all COC's? Yes
4. Are constitues which are not of concern identified? Yes
5. Is there a data gap/ Or not enough data related COC's? No

The GW quality data collection is from 1990 to 2020
The monitoring wells are from agriculture, domestic, state small weater supply well, public water supply well, contamination site monitoring well and reserahc monitoring well. 
They have mapped temporally and spatially Arsenic, Boron, Benzene, Iron, Manganese, NItrate, pH, specific conductivity, In appendix 2b
NO graph of TDS, the range of TDS historically is between 131 to 1240. Could they confirm if TDS is now under control?",
Martha,,,DACs,2,"Does the GSP identify the sources of water for DACs (e.g., what percentage is supplied by groundwater?","No= no mention fo DACs and their source
Somewhat= general reference to DACs, and general source reference
Yes=Explicit naming of DAC & Source","Disadvantaged Communit*, DAC",No,,,GSP does not mention any details about sources of water for DAC population..,
Becky,BASIN SETTING,Interconnected Surface Waters (ISW),Environment,1,"Are gaining and losing reaches adequately assessed spatially and temporally (e.g., groundwater levels (from proximate wells to streams and sufficient density of wells along streams) compared with stream elevation; numerical modelling)? If so, please describe the approach used in the Notes. "," no map or description = no
1)includes map but data from one point in time was used, 2)includes map but no clear description of methodology = somewhat
 ISW map and ISWs were delineated using multiple water year types AND description of temporal variability= yes","Interconnected surface water, ISW, gaining, losing",Somewhat,"The Shasta River and its major tributaries are all considered part of the interconnected surface water system in the Basin.  

&& In most years, the net direction in the entire watershed of stream-aquifer flux is as groundwater discharge into the river, with the largest net groundwater replenishment from streams occurs in wet years. Seasonally, the magnitude of stream leakage from the streamflow system to the aquifer is greatest during late winter and early spring, while the net magnitude of groundwater discharge  to the stream is greatest in late fall at the end of the dry season (least seasonal recharge). The mainstem Shasta River is alternately gaining and losing depending on the season, on the location, and on the year type. In other words, river water weaves in and out of the aquifer on its journey north to south along the valley floor. When considered as a whole, the mainstem of the Shasta River is a gaining reach. The upper sections of tributaries tend to be losing stream reaches but  conditions depend on precipitation levels during any given water year and some of the tributaries tends to be dry in the summer months before connecting to the main stem of the Shasta River. 

&& Springs feed surface waters on the east side of the watershed due to the volcanic geology (Figure 44). The Plutos Cave Basalt transmits the majority of Shasta River base flows, discharged as  springs in the southeast, and is responsible for nearly all the unimpaired summer base flow of >100 cfs in the Shasta River (SVRCD 2018. SVRCD 2018b). This base flow sustains summer flows in the river despite low precipitation in the valley and is dependent on snowmelt from annual snowfall  and glaciers in the surrounding mountains (SVRCD 2018b). 

&& The GSA is working with SVRCD to conduct transect studies for the Little Shasta River and Shasta River to determine the direction of flow exchange. Historically, the Little Shasta River rarely has surface water during the irrigation season due to adjudicated water rights (SVRCD 2018). During that period, the Little Shasta River is known to disappear and reappear at locations upstream of the confluence with the Shasta River (SVRCD 2018). Preliminary results indicate that, between May to October 2020, the Little Shasta River was losing at its transect location in the Little Shasta Valley. Upstream and downstream of the Little Shasta River confluence, the Shasta River was gaining in both transect locations (David’s Engineering 2020). For additional information, see Appendix 2-H. This study will continue as long as funding is available, with current funding allowing the study to last until December 2021. Expansion of the transect study to other locations in the Basin ill
 depend on funding. && These results indicate that the Shasta River was generally gaining in the transect location over the study period, with some potential losses to the aquifer adjacent to the left bank in the late summer (David’s Engineering 2020).","Page 105-106, 107, 108, 112 / 2.2.2.6 && Figure 43 && Figure 44","1. Is there a clear map of ISWs? Somewhat - there is a map of interconnected surface waters but lack of visualization for gaining and losing reaches
2. Was temporal variability used and described? no - Data is only from one year (with multiple seasons in that one year)
3. Methods: Are there sufficient data (well locations in proximity to streams, well density, screening depths) to inform assessment? somewhat

The plan relies on prevous reports by SVRCD and an on-going transect study to assess ISWs.  Figure 43 shows all of the surface water in the basin and the highlighed interconnected main reaches. From the figures, it appears everything is connected, but there is a lack of visualization of gaining and losing reaches.  The transect study incorporates groundwater levels, surface water levels, and water temperatures from three locations in the basin and  only has data (so far) from May to October 2020. Specific groundwater measurments and surface water elevations are not provided. Lack of multi-year data and description of water year type, but fairly detailed description of spatial and temporal ISWs in basin. ",
Becky,,,Environment,1,"Are the conclusions of ISWs (e.g., no ISWs, some gaining/losing/disconnected) consistent with the assessment? Please describe details in the Notes.","1) no conclusions due to lack of data 2) vague and contradictory conclusions that do not make sense with the assessment 3) concrete conclusions made off of little to no evidence or data. = no
conclusions lacks some detail and evidence to support claims = somewhat
 the conclusions are coherent with the analysis and available data= yes","Interconnected surface water, ISW, gaining, losing",Yes,"The Shasta River and its major tributaries are all considered part of the interconnected surface water system in the Basin. Their large seasonal flow variations exhibit all five elements of the recently proposed functional flow framework for managing California rivers: fall flush flow, winter storm flow, winter baseflow, spring recess, and summer baseflow. The system is also subject to significant interannual variations in flow and largely affected by the complex springs system that is present throughout the valley as a result of the volcanic origin.

&& Both transects along the Shasta River (SRU and SRD) had higher shallower groundwater water surface elevations in the piezometers than surface water elevations throughout the study period. Overall, shallow groundwater levels relative to surface water showed relatively consistent trends during the study period. The shallow groundwater levels in the two transects along the Shasta River tended to be higher in elevation and have a hydraulic gradient towards the river, while inthe Little Shasta River they tend to be lower in elevation and have a hydraulic gradient away from the river. While these trends were influenced by a variety of factors, one that may contribute to differences is the irrigation of lands on either side of the river, as the lands along the Shasta River inthe vicinity of the transect were irrigated while lands along the Little Shasta River were unirrigated. Temperature differences varied between the transects, but overall showed the same general trends. The shallow groundwater was lower in temperature at the start of the study in May 2020  (e.g. negative values), and the differences increased into the summer as surface water temperatures increased more rapidly than groundwater temperatures. However, in late summer and early fall, as groundwater temperatures continued to slowly rise and surface water temperatures began falling, the trend reversed. The differences decreased and then became positive, reflective of surface water temperatures decreasing below shallow groundwater temperatures. The tempeature difference was the smallest for the LSR transect and greatest for the SRD transect. The temperature difference may have been greater at the SRD transect than the SRU transect because  of surface warming in the Shasta River as it flowed downstream. The temperature difference comparison at all transects reflected the slower changes in shallow groundwater temperaturesrelative to surface water temperatures (David’s Engineering 2020).
",Page 116 / 2.2.2.6,"1. Are ISWs mapped in the basin? Yes
2. Is the mapping consistent with the assessment? Yes

Based on available data and previous reports, the plan describes in detail the gaining and losing stretches of the main surface water bodies. The plan acknowledges that this study will continue if funding continues.",
Becky,,,Environment,1,"Are all shallow principal aquifers acknowledged in defining ISW? Note: if there is only one unconfined aquifer in the basin, consider this aquifer as the shallow aquifer.","no aquifers are acknowledged; shallow aquifer is acknowledged, but not considered principle for reasons like not the main pumping aquifer = no
All principal shallow aquifers are not acknowledged in ISW section (if multiple exist) = somewhat
Adequate data from shallow aquifer(s) is used in defining ISWs and all principal shallow aquifers are acknowledged= yes","principal aquifer, shallow ",Yes,"Shallow piezometers were installed in three transects across the Shasta Valley in late April 2020: two transects along different reaches of the Shasta River and one along the Little Shasta River. One of the transects on the Shasta River was upstream of the confluence with the Little Shasta River (SRU), and the other was downstream of the confluence with the Little Shasta River (SRD) (Figure 46). The transect along the Little Shasta River (LSR) lay within the alluvial portion of the Little Shasta Valley. These piezometers, along with the rivers, were instrumented to continuously monitor water surface elevations and temperatures in and adjacent to surface water features. 
&&
Springs feed surface waters on the east side of the watershed due to the volcanic geology (Figure 44). The Plutos Cave Basalt transmits the majority of Shasta River base flows, discharged as springs in the southeast, and is responsible for nearly all the unimpaired summer base flow of >100 cfs in the Shasta River (SVRCD 2018; SVRCD 2018b).
",Page 108-109 / 2.2.2.6,"1. Are all shallow aquifers acknowledged in the ISW section (if multiple exist)? Yes - the plan acknowledges the two ""primary"" aquifers in the ISW section - the shallow quaternary alluvium and Pluto's Cave basalt (see page 51)
2. Does the plan consider the shallow aquifer(s) as principal aquifer(s)? Yes
",
Becky,,,Environment,2,Were data gaps identified when mapping ISWs?,"no data gaps identified when there is an obvious lack of data = no
1) Vague and/or confusing mention of lacking information 2) Mention of ISW data gaps in separate section in GSP. = somewhat
Clear description of where data gaps exist (temporally and spatially) in ISW section or Data Gaps Section following the assessment= yes","Interconnected surface water, ISW",Yes,"Springs fed by the Plutos Cave Basalt include the Big Springs Complex (SVRCD 2018). The Big Springs Complex encompasses Big Springs Lake, Big Springs Creek, and Little Springs Creek (Figure 43). The extent of the springs complex is a data gap but contributions of Big Springs Creek  to the Shasta River is estimated to be 60 cfs, and historically (pre-diversion) contributed 100 to 125  cfs (Deas 2006).
",Page 107 / 2.2.2.6,"1. Were data gaps identified? Data gaps were addressed when describing the spring system. No other data gaps discussed despite of a lack of groundwater data used to described ISWs
2. Were the data gaps identifed in the ISW section? yes

Data gaps were addressed when describing the spring system. No other data gaps discussed despite of a lack of groundwater data used to described ISWs",
Becky,,,Environment,2,"In the case of data gaps and uncertainty, were streams mapped and described as potential ISWs in the GSP? If ISWs are adequately mapped and there is no uncertainty in the ISW mapping, then select ""Not Applicable"".","no description or map of potential ISWs = no
1) partial inclusion of potential ISWs 2) only a description but no map or vice versa = somewhat
All uncertainties and data gaps are clearly described and mapped temporarily and spatially= yes","Interconnected surface water, ISW, data gap",No,,,"1. Is there a map AND description of pISW?

No map or description of pISWs. The Shasta River and all major tributaries are considered interconnected, but no discussion of minor tributaries.",
