Unnamed: 0,GENERAL,Unnamed: 2,General Notes ,Unnamed: 4,Unnamed: 5,Unnamed: 6,GSP Information,Answer,Unnamed: 9,Unnamed: 10,Unnamed: 11,Unnamed: 12
Meagan,,,DACs / Tribes / Drinking Water Users,1,"Do the Representative Monitoring Sites (RMS) in the monitoring network adequately represent shallow groundwater elevations around DACs, domestic wells, and Tribes (In the case of data gaps, evaluate proposed monitoring sites). In the notes, please specify any deficiencies in the distribution of representative monitoring sites (RMS). Yes = existing and proposed monitoring wells are adequately distributed across DAC, drinking wells, and tribal areas; Somewhat = existing and proposed RMS do not adequately cover DAC, drinking wells, and tribal portions of the basin; No = Existing and proposed RMS are not available within DAC, drinking wells, and tribal areas.","NO = RMS are not located within a mile of any DACs, domestic wells, or tribes
Somewhat = RMS are within one mile of at least one DAC, domestic well or tribe
Yes = RMS are within one mile of ALL DAC, domestic and tribal communities within the basin boundary
","shallow monitoring well, data gap, disadvantaged communit*, DAC, tribal, tribe",Somewhat,,Page 21 Figure 4 / ch 3,"1. How were Elevation RMS listed? (CASGEM ID, lat/long, described) Site ID, CASGEM ID
2. How many Elevation RMS were we able to map? (all, some, none) Some
3. Of those mapped, was there a well within 1 mile of DACs? Yes
4.Of those mapped, was there a well within 1 mile of Tribes? No
5. Of those mapped, was there a well within 1 mile of domestic wells? Yes

Monitoring Network for groundwater elevations fails to represent southmost DAC communities as well as tribes and SDAC communities in top left of basin, top right of basin also lacks monitoring",
Becky,,,Environment,1,Does the GSP include a plan to identify and fill shallow monitoring well data gaps around GDEs and ISWs in the monitoring network?,"No plan in place to identify and fill shallow well data gaps around GDEs and ISWs; no potential plan
  = no
Mention of shallow monitoring data gap and need to fill but no detailed plan in monitoring network or PMAs; contradictory statements in different sections; potential PMA; City is handling it = somewhat
GSP has a clear plan to fill spatial and/or temporal data gaps with regards to GDEs and ISWs in monitoring network section or PMAs
. = yes","shallow monitoring well, data gap, groundwater dependent ecosystem, groundwater-dependent ecosystem, GDE ",Yes,"The GSP Regulations provide that the monitoring network for Depletions of Interconnected Surface Water should include “[m]onitor[ing] surface water and groundwater where interconnected surface water conditions exist, to characterize spatial and temporal exchanges between surface water an groundwater and to calibrate and apply the tools and methods necessary to calculate depletions of surface water caused by groundwater extractions. (23 CCR 354.34(c)(6).) The monitoring of interconnected surface water (ISW) will be conducted to establish two objectives. The first objective of the ISW monitoring network is to evaluate groundwater contributions to the Shasta River during the irrigation season. The second objective is to monitor shallow groundwater for protection of vegetative GDE’s, as identified in Chapter 2. The monitoring network will use surface water gaging stations, measured surface water diversions, and groundwater elevations to assess sustainability. Section 3.4.3 provides background and justification on site location and methodology. 

&& While groundwater levels as a proxy for stream depletion monitoring are by themselves not suitable for the Basin, these measurements will be collected and used to assess long-term trends in water level gradients and to avoid long-term, Basin scale water level declines (see Sections 3.3.1 and 3.4.1). These data, among many others, will also be used to calibrate and improve SWGM. The refined and calibrated version of SWGM over the next 5 years will be able to account for and processes a much wider range of relevant land use, hydrologic, and geologic data that would not be reflected in water level data alone. 

&& Inclusion of additional stream gaging stations, including Shasta River near Yreka (SRY), Shasta River at Grenada Pump Plant (SPU), Water Wheel, and Parks Creek are expected to be part of the 2027 ISW monitoring network (Table 5). These sites are not included in the current monitoring network due to insufficient historical data. If sufficient funding is available for monitoring at these sites, they will be added to the monitoring network and SMCs set. The ISW monitoring network currently has the Little Shasta River as a data gap. Ongoing work by SWRCB and UCD Watershed Sciences in evaluating the interconnection of groundwater and surface water in the area are expected to inform the work of the GSP. Monitoring of the upper Little Shasta River watershed using the water balance method is expected to be implemented during the 2032 GSP update. && Mapped GDEs in northern section of the Valley (Figure 49 in Chapter 2) will be monitored by groundwater elevations in the vicinity. GDE monitoring is best served by continuous monitoring wells within the GDE, but this type of data has been already highlighted as a data gap in the Basin. Water levels in well SV02 are monitored continuously and is currently the best candidate for monitoring groundwater levels for GDEs in the vicinity. Well SV02 is outside any GDE but near enough to monitor groundwater levels. In Section 2.2.2.7, GDEs are identified through historical groundwater levels so nearby monitoring wells should also remain within historical levels. Though SMCs for GDEs are not required by SGMA, the minimum thresholds for SV02 will be set to protect beneficial users such as GDEs and set at the Fall minimum (add graph of water levels). Further data collection based on other continuous well monitoring near critical GDEs and satellite images to evaluate twice per year the health of GDEs will be included in the management actions for future monitoring.

&& As part of the monitoring network, the SVRCD is conducting piezometer transect studies, herein referred to as “the Project”, at three discrete locations in the Shasta Valley groundwater basin. At each of the three locations the Project consists of installation of a stilling well to measure river stage within the channel, and up to four piezometers, or shallow monitoring wells, in a series spanning key reaches of primary surface water bodies within the basin. The piezometer transects will provide critical information about when a given reach is gaining water, loosing water, and increase  understanding of interactions between surface water and groundwater through better representation of the gradient between river and aquifer and therefore model refinement. Details on the location of the transects are provided in Chapter 2 and in Appendix 2-I).",Page 27-28 / 3.3.4.1 && Page 30 / 3.3.4.2 Page 44-45 / 3.4.3.2 && Page 12 / 4.2,"1. Is there a plan to fill shallow groundwater wells in the monitoring network section? yes - piezometers are being installed (or will be installed) to collect shallow groundwater data to assess ISWs
2.And/OR is there a plan to fill shallow groundwater wells in the PMA section? No",Changed from somewhat to yes becuase there is a clear plan to install piezometers
Becky,,,Environment,2,Does the GSP include any plans to incorporate GDE-related biological monitoring into the monitoring network?,"No plan or mention of biological monitoring 
  = no
Some coordination with other agencies; Mention of the possibility of future biological monitoring/surveys = somewhat
Clear plans for biological monitoring are described; Remote sensing; field surveys, etc. = yes","GDE Pulse, NDVI, normalized difference vegetation index, biologic*, survey, vegetation, fish",No,,,"1. Is there a plan in place for biological monitoring, including but not limited to field surveys, remote sensing (NDMI, NDVI), aerial photographs? No",
Sara,PROJECTS & MANAGEMENT ACTIONS,,Environment,2,Does the GSP include any recharge projects with explicit benefits to the environment?,"NO = no recharge &/no mention of benefits, &/ on-going project without coordination. SOMEWHAT = benefits to environment generally &/or on-going project with coordination &/or proposed project;  YES = explicit benefits to environment & the GSPs implementing;","recharge, managed aquifer recharge, MAR, multi-benefit recharge",Yes,"As already mentioned in the description of the Shasta pilot recharge project, Managed Aquifer Recharge (MAR) is the process of intentionally adding water to aquifers and In- Lieu Recharge (ILR) is storing or preserving groundwater through replacement of some or all of groundwater use with surface water. This project builds on findings obtained from the Shasta pilot recharge project and plans on extending the areas where MAR and ILR (during the irrigation season) can be used to recharge groundwater at watershed scale. If winter water rights can be obtained. Winter recharge could help prevent recurrence of domestic well outages near these cities. Expected Benefits: The primary benefit of MAR and ILR is to reverse streamflow depletion through augmenting baseflow in Shasta River during the critical summer and fall periods. This is expected to provide benefits to aquatic species, including anadromous fish (as discussed in Chapter 2.X), water quality and habitat. Potential expected benefits from implementation of these projects were modelled, and results are shown in Appendix 4-A.
",Page 30 & 31/,"1. Are there projects that involve groundwater recharge? Yes
2. Do those projects list explicit benefits to the environment? Yes
3. Are the projects new, on-going or proposed? new
4. Are the projects implemented by the GSP or others?  GSP
5. If others, is the GSP coordinating with the others in implementation? NA

They have MAR project to benefit aquatic species, including anadromous fish.
They have projects to benefit the nevironment but not recharge projects too Refer to I67",
Sara,,,Environment,2,"Does the GSP include any habitat or stream restoration or invasive species removal projects (e.g., to improve water supply in the basin or GDE habitats)?",NO = on-going project without coordination. SOMEWHAT = on-going project with coordination &/or proposed project;  YES = the GSPs implementing;,"invasive species, habitat",Yes,"Habitat Improvement in Shasta Watershed The GSA will cooperate with a combination of agencies to improve habitat conditions within the Shasta watershed. This will include a combination of treatments including adding large woody debris along four miles of stream, modification of stream crossing structures, and meadow restoration. Other treatments include riparian fencing, tree planting, and bank enhancement. These treatments will add stream habitat structure and complexity, improve connectivity and aquatic organism passage. These improvements will not directly have an impact on groundwater conditions and/or on groundwater use, but they should be included as potential multi-benefit projects where the GSA can develop collaboration with other agencies and enhance opportunities for funding. &&&Novy Ice Zenkus Fish Passage Improvement Project The goal of the project is to improve habitat conditions, water quality, and fish passage on the main-stem Shasta River. The project includes irrigation dam improvements, fish screen relocation and improvements, and irrigation pipeline installation. Relocating the fish screen to the point of diversion will reduce fish entrainment in irrigation canals and eliminate the need for the existing fish return bypass channel, which results in warm water discharges to the Shasta River and potential fish stranding. Piping irrigation water will reduce ditch loss in the system and will result in a reduction of the quantity of water diverted. Montague-Grenada Weir Modification Project The purpose of this project is to improve fish passage for salmon species through all life stages while preserving the ability of the existing measuring weir to provide accurate flow measurements in the Shasta River. This project will also improve flow control at the pump station just downstream from this concrete structure. &&& Enhancement of Survival Permits Authorizing Shasta River Template Safe Harbor Agreement and Associated Site Plans/ Recovery of Southern Oregon/Northern California Coast (SONCC) Coho Salmon Safe Harbor agreements allow private landowners to implement habitat enhancement projects on their land in support of recovery of species protected under the ESA.","Page 24 / 4.2
Page 11 / 4.2","
If yes to projects:
1. Are the projects new, on-going or proposed? new
2. Are the projects implemented by the GSP or others? GSP
3. If others, is the GSP coordinating with the others in implementation?  na

They have different projects to imrove aquatic habitat

",
Sara,,,All,1,"Does the GSP identify benefits or impacts of identified projects and management actions to key beneficial users such as GDEs, drinking water users, tribes, DACs?","NO = no mention of benefits, &/ on-going project without coordination. SOMEWHAT = benefits to beneficial users broadly &/or on-going project with coordination &/or proposed project;  YES = explicit benefits to environment & the GSPs implementing;","beneficial users, environment, GDE, DAC, trib*",Somewhat,"Aquifer Characterization Analysis: By preventing future declining water levels, the MA will help the GSA achieve the  measurable objectives of several sustainability indicators: groundwater levels, groundwater storage, subsidence, and interconnected surface water and GDEs. Circumstances for Implementation: Currently, there is no threat of chronically declining water levels in Shasta Valley. The Basin is not in a condition of overdraft. Future threats to groundwater levels fall into two categories, further explained below:  Increased total net groundwater use in the Basin (total net groundwater use: difference between Basin landscape recharge and Basin pumping).  Reduced recharge into and runoff from the watershed surrounding the Basin This MA ensures that future declining water levels are not the result of any significant expansion of groundwater pumping in the Basin (first category), which would lead to new, lower equilibrium groundwater level conditions (see Chapter 2). While not constituting a condition of overdraft, these new dynamic equilibrium conditions may possibly exceed the MT for water level, also affecting the protection of GDEs and increase the depletion of interconnected surface water due to groundwater pumping at periods of critically low streamflow and spring flow conditions (summer and fall). Groundwater levels in the basin are fundamentally controlled by:  The elevation and location of the Shasta River along the valley. The Shasta River is a net gaining stream, naturally draining the Basin. Segments of the river switch from gaining to loosing during the year, but on annual average the entire river is always a gaining system. Water budget analysis presented in Chapter 2 provides more details  The amount of recharge from surface water feature in the upper part of the Basin, including Shasta River, Lake Shastina, and along westside creeks over their upper and middle alluvial fan sections; and the amount of recharge over the watershed to the south and east of the Basin and subsequent groundwater inflow from the upper watershed into the Basin.","Page 15, 16 / 4.2","""1. Do they identify explicity beneficial users?   GDEs, but not others
2. Do they describe the impact or benefit to the users identified? Somehow
3. Across all PMAs, do they include GDEs, drinking water users, Tribes and DACs? If yes, which? GDE
4. Are the projects proposed, ongoing? New
5. Are the projects implemented by GSA or others?GSP
6. If others, is the GSP coordinating with the others in implementation? na

NO mention of Tribes, DAC and drinking water users in this section. Aquifer Characterization Analysis just analysis the impacts on GDE",
Martha/Sara,,,DACs,2,Does the GSP include any recharge projects with explicit benefits to DACs?,"NO = no mention of benefits, &/ on-going project without coordination. SOMEWHAT = benefits to beneficial users broadly &/or on-going project with coordination &/or proposed project;  YES = explicit benefits to environment & the GSPs implementing;","recharge, managed aquifer recharge, MAR",No,,,"1. Are there projects that involve groundwater recharge? yes
2. Do those projects list explicit benefits to DACs? no
3. Are the projects new, on-going and proposed? na
4. Are the projects implemented by the GSP or others? na
5. If others, is the GSP coordinating with the others in implementation? na
",
Sara,,,DACs / Drinking Water,,Does the GSP include a drinking water well mitigation program to avoid significiant and unreasonable loss of drinking water?,"NO: No well mitigation program SOMEWHAT: well mitigation program, but not explicitly for drinking water users and DACs &/ proposed or on-going with coordination YES: well mitigation program for drinking water users and DACs","drinking water, well mitigation program",No,,,"1. Is there a well mitigation program? no
2. Is the program new, on-going or proposed? na
3. Is the well mitigation program explicitly for drinking water users and DACs? na

",
Sara,,,DACs,1,Does the GSP identify potential impacts to water quality from Projects and Management Actions?,"NO = no mention of benefits, &/ on-going project without coordination. SOMEWHAT = benefits to beneficial users broadly &/or on-going project with coordination &/or proposed project;  YES = explicit benefits to environment & the GSPs implementing;","water quality, disadvantaged communit*, DAC",Somewhat,"Shasta River Tailwater Reduction Plan Watershed-wide planned and prioritized approach that guides efforts to reduce tailwaters’ negative impacts to water quality, mostly temperature. Temperature has not been the main focus of this GSP, but it will be considered in further developments.",Page 12 / 4.2,"1. Do those projects list potential impacts to water quality? Yes
2. Do those Projects list potential impacts to DAC? No
3. Are the projects new, on-going or proposed?na
4. Are the projects implemented by the GSP or others? na
5. If others, is the GSP coordinating with the others in implementation?na

They have project to make water quality better",
Lauren,OTHER,,,,Does the GSP have plans to use Open ET to monitor groundwater extractions from agriculture?,"No: Open ET not mentioned in GSP
Somewhat: Satellite based evapotranspiration used in analysis and monitoring for future groundwater extractions from agriculture
Yes: Open ET identified as a resource that will be used for monitoring future extractions from agriculture",OpenET,No,,,,
Lauren,,,,,Does the GSP have plans to install meters on wells in the basin?,"No: No mention of installing meters on wells or mentions meters as a DWR recommendation but no plans to install
Somewhat: Mentions potential plans for installing meters in event of exceedance, or identifies need for meters but no details of plans for installation
Yes: Describes plans for installing meters in detail as a planned project  ",meters,Somewhat,"Owners and/or operators of groundwater wells, meeting a certain criteria, are encouraged to report pumping volumes. The reporting of pumping volumes will establish baseline values as well as provide information for the Shasta Watershed Groundwater Model. The suggested criteria for wells that should report are:
• Pumps Operated above 500 gallons per minutes; or
• Pumps used for commercial purposes.
Reporting can be done one of three ways:
1. A flow meter or totalizer will be installed and read on a monthly basis...
...Possible subsidies in installation of flow meters from future grants will be explored.
&&
For the purpose of the GSP, pumping curtailments are defined as voluntary or mandatory reductions or limitations in the amount of water a current or future groundwater user can pump from the Basin. This would be applied in the case of a situation where the planned Projects and Management Actions are insufficient to reach and/or maintain sustainability and one or more sustainability indicators are likely to dip below the minimum threshold by 2042. Under such a curtailment scenario, the GSA would first determine, using SWGM and other hydrologic assessment tools, the amount of water that affected pumpers could take sustainably, and the pumpers would be required to reduce their groundwater extraction to that allocation. All pumpers subject to allocations and curtailment would be required to be metered. Curtailments may be temporary, seasonal, or permanent.","Page 7 / 3.3
Page 32 / 4.3
","The management action related to curtailing GW pumping is listed as a ""Potential Future Project and Management Action"" (i.e. no concrete plans to install meters)",
Lauren,,,,,"Does the GSP have plans to implement demand reduction (e.g., pumping cuts) in the basin to achieve sustainability?","No:  Demand reduction not mentioned 
Somewhat: Mentions potential plans for demand reduction in event of exceedance, or future potential PMAs of demand reduction
Yes: Planned PMAs of demand reduction are described","demand, demand reduction, pumping cuts, demand management",Somewhat,"In many of the groundwater basins subject to SGMA throughout the State, pumping restrictions are one of the key components of the GSP. In Shasta Valley, the current level of Basin pumping, minus voluntary pumping reductions, can be continued with the effective implementation of Tier I and Tier II PMAs. However, the GSA also acknowledges that pumping curtailments are an effective tool that may need to be used in the future to achieve groundwater sustainability.
For the purpose of the GSP, pumping curtailments are defined as voluntary or mandatory reductions or limitations in the amount of water a current or future groundwater user can pump from the Basin. This would be applied in the case of a situation where the planned Projects and Management Actions are insufficient to reach and/or maintain sustainability and one or more sustainability indicators are likely to dip below the minimum threshold by 2042. Under such a curtailment scenario, the GSA would first determine, using SWGMand other hydrologic assessment tools, the amount of water that affected pumpers could take sustainably, and the pumpers would be required to reduce their groundwater extraction to that allocation. All pumpers subject to allocations and curtailment would be required to be metered. Curtailments may be temporary, seasonal, or permanent.
SGMA legislation allows for charging fees for pumping in excess of allocations, or for noncompliance with other GSA regulations (CWC Section 10732 (a)). The GSA will consider adoption of fees and/or other penalties for violations of pumping allowance and/or reporting if curtailments are implemented.
In the event of a need to restrict pumping, pumping restrictions could also be placed on new wells. Restrictions on permits for new groundwater wells would be considered if there was high demand for wells that, if constructed, could lead to the basin water extractions exceeding the sustainable yield for the basin. Alternative, restrictions on permits in specific areas would be considered if additional localized pumping could drive one or more sustainability indicators below the minimum threshold. In the absence of a basin adjudication, pumping restrictions on new uses would need to be applied equitably and in a similar proportion to restrictions on existing users.",Page 32 / 4.3,"This is a ""Potential Future Project"" without any concrete plans to implement",
Lauren,,,,,"Does the GSP have plans to implement supply augmentation (e.g., recharge projects, desalinating brackish groundwater) in the basin to achieve sustainability?","No: No plans in place for supply augmentation
Somewhat: Potential projects or evaluations of feasibility to implement supply augmentation mentioned
Yes: Planned supply augmentation described in detail to achieve sustainability","recharge, managed aquifer recharge, MAR, desalin*, brackish groundwater",Yes,"Shasta Recharge Pilot Project
The project will divert water from the Shasta River or its tributaries onto target land near Gazelle and Grenada for winter groundwater recharge when enough water is available in the river. Specific locations for the pilot recharge project will be proposed, and initial baseline studies will occur. Following results, long term and larger recharge projects will be designed and built. The goal for this project is to provide a preliminary assessment of more large scale as in future recharge opportunities in the Basin. It will also provide a good opportunity to start exploring availability of water, based on year type and climate conditions in general. This project should be considered as a pilot explorative project that will enhance data collection and understanding of the Basin characteristics.",Page 27 / 4.2,"This is a Tier II project, and is planned for implementation within 5 years of GSP acceptance",
