Unnamed: 0,GENERAL,Unnamed: 2,General Notes ,Unnamed: 4,Unnamed: 5,Unnamed: 6,GSP Information,Answer,Unnamed: 9,Unnamed: 10,Unnamed: 11,Unnamed: 12
,,,"ISW: Overall, decent assessment; map of ISWs but lack of visualization of gaining/losing reaches; conclusions of iSWs are consistent with assessment; shallow principal aquifers acknowledged; no map or description of pISWs of minor tributaries
GDE: good inventory of flora and fuana in GDEs; map of GDEs from NC dataset; more information needed about data used; unsure on methods of removing GDE polygons; pGDEs are somewhat mapped/described
Stakeholders: Overall the gsp is lacking outreach and engagement documentation forGSP implementation, although they do map Tribes there is no specific map of DACs even though they are named. ",,,,GSP ID,18,,,,
,,,,,,,GSA Name,Siskiyou County Flood Control and Water Conservation District GSA,,,,
,,,,,,,Subbasin Name,SHASTA VALLEY,,,,
,,,,,,,Consultant,,,,,
,,,,,,,GSP version,Draft,,,,
,,,,,,,Acreage of GDEs per basin,2305,,,,
,,,,,,,DAC Population,13696,,,,
,,,,,,,Tribal population,0,Answer NA if Tribal Population is 0 and there is no mention of tribes described in the GSP.  Answer all Tribal related questions even if tribal populations are 0 and the GSP mentions tribes in the basin.,,,
,,,,,,,Acreage of Managed Wetlands,No Data,,,,
,,,,,,,Coder Name,Martha,,,,
,GSP Plan Element,,Topic,Level,Criteria,Spectrum,Key Search Terms,Answer,Relevant Text from GSP,GSP Page / Section,Notes,
Martha,PLAN AREA,,DACs,1,"Does the GSP document how DAC stakeholders were given opportunities to engage in the GSP development process? If so, please describe the level of engagement (e.g., whether stakeholders were on an advisory committee, GSA board, working group) in the Notes. Answer according to level of engagement: Yes = Involve, Collaborate, Empower; Somewhat = Inform and Consult; No = No mention of engagement. ","no = no reference to DACs, no reference to stakeholder engagement during development 
somewhat=  no specific reference to DAC engagement but lists DAC as a stakeholder, provides stakeholder engagement details 
Yes= references DACs and how they were engaged specifically during development beyond informing DACs
","Disadvantaged Communit*, DAC, stakeholder, beneficial user",Somewhat,"Community Involvement
To ensure broad public awareness and involvement as the GSP is developed, the GSA has tasked Advisory Committee membes to act as liaisons to educate, inform and solicit input from the wider local community throughout the collaborative process. Key meetings and milestones during the process in which the general public is encouraged to attend and provide feedback on draft GSP content or other SGMA related issues include, but are not necessarily limited to  • Bi-monthly Advisory Committee meetings when draft GSP sections are introduced, discussed or evaluated by members • Advisory Committee engagement with constituents, with support as needed from GSA staff, during related meetings, events, and discussions by members, • Stakeholder meetings led by GSA staff with participation from Advisory Committee members, Technical Consulting Team members and/or Facilitation Support Services • Public comment periods when draft GSP sections are made available for review • Regularly scheduled District Board meetings • Special meetings that are scheduled, noticed in advance and open to the public At key intervals during GSP development, the GSA will hold public meetings in order to share information, respond to questions or concerns about SGMA, and solicit input from the wider community. Interested parties can also reach out to District staff at any time to share and discuss specific elements of the GSP or SGMA in general.

Human Right to Water: Inform and involve to provide safe and secure groundwater supplies to disadvantages communities Edgewood; Lake Shastina Community District; Siskiyou County Service Area 5 – Carrick, Gazelle and Montague","Communications & Engagement Plan page 6, 7","1. DAC's identified? (yes/no): yes
2. If yes, which level of engagment: non-DAC specific  inform & consult
3. Evidence/strategies listed for level of engagement: meetings and comments

GSP has listed DACs as stakeholders in the Communications & Engagement Plan. They have also included ways that all stakeholders can engage. Although there is no specific DAC-engagement their vague language could include DACs. ",
Martha,,,Tribes,1,"Does the GSP document how tribal stakeholders were given opportunities to engage in the GSP development process? If so, please describe the level of engagement (e.g., whether stakeholders were on an advisory committee, GSA board, working group) in the Notes. Answer according to level of engagement: Yes = Involve, Collaborate, Empower; Somewhat = Inform and Consult; No = No mention of engagement. ","No = no reference to Tribes , no reference of stakeholder engagement opportunities
Somewhat= No specific Tribe engagement described, lists Tribes as stakeholders, includes stakeholder engagement details
Yes = reference to Tribes in the Basin, documents targetted engagment opportunities for Tribal stakeholders beyond informing","Tribal, tribe, stakeholder, beneficial user",Yes,"Tribal Engagement: In addition to the role that tribal representatives will play on Advisory Committees, the GSA will, as noted, maintain a government-to-government relationship with any tribe in the Siskiyou County/Klamath River watershed region that expresses interest in participating in SGMA activities. The GSA will seek to foster trust building, provide the opportunity for tribes to have meaningful involvement, and create a forum by which sovereign tribes can communicate their respective needs and interests around SGMA. As noted earlier, the GSA has utilized DWR Facilitation Support Services to help develop and maintain positive relationships with interested tribes.

Advisory Committee Members
• Tristan Allen, Montague Water Conservation District
• Lisa Faris, Big Springs Irrigation District
• Susan Fricke (Vice-Chair), Karuk Tribe Representative
• Blair Hart, Private Pumper
• Justin Holmes, Edson-Foulke Ditch Company
• Steve Mains, Grenada Irrigation District
• Robert Moser, Municipal/City (Lake Shastina Community)
• Peter Scala, Private Pumper
• John Tannaci (Chair), Residential
• Gregg Werner, Environmental/Conservation Representative
• Justin Sandahl, Shasta River Water Users Association

Tribal Engagement To foster meaningful engagement with Native American Tribes, the GSA will maintain a government-to-government relationship with any tribe in Siskiyou County or the larger Klamath River watershed which expresses interest in SGMA. In addition, the GSA has appointed a tribal representative to the Advisory Committees for the Shasta Valley, Scott Valley and Butte Valley groundwater basins. Tribal representation on these committees is based on multiple factors, including cultural relationship to the area, ancestral territory and land held in trust or reservation  6 within a given basin. The GSA has begun developing communication protocols and coordination agreements with tribes who have voiced interest in SGMA. Individual tribes are recognized as sovereign tribal nations; no one tribe represents another. In Shasta Valley, the Karuk Tribe is represented on the local SGMA Advisory Committee. 


Native AmericanTribes:
Inform, involve and consult
with tribal governments (See
DWR Tribal Engagement with
Tribal Guidance Document 7):
Shasta Indian Nation; Karuk Tribe;
Quartz Valley Tribe; Yurok Tribe;
Modoc Tribe of Oklahoma

The GSA maintains a government-to-government relationship with any Native American Tribe in Siskiyou County or the larger Klamath River watershed which expresses interest in SGMA. Tribal representatives have been appointed to the advisory committees in the Scott Valley, Shasta Valley and Butte Valley groundwater basins. Moreover, Siskiyou County and the Karuk Tribe formalized good faith communication protocols around SGMA through an established memorandum of understanding. 

Karuk Tribe
 The GSA developed a Memorandum of Understanding (MOU) with the Karuk Tribe regarding improving coordination and communication efforts related to GSP development which provided a bridge of opportunity to  discuss and deliberate on GSP development for the Scott and Shasta basins. This took multiple meetings, with valuable assistance from DWR provided Facilitation Support Services. The MOU (in Appendix 1-D) was signed and approved by the District Board on March 17, 2020. ","Communications & Engagement Plan page 5,6, 8, 12, 15
1-6
1-9","1. Tribes identified? (yes/no): Yes
2. If yes, which level of engagment: Empower
3. Evidence/strategies listed for level of engagement: MOU with Karuk Tribe and Karuk tribe has a rep on the advisory committee

GSP has listed Tribes as stakeholders, specifically Shasta Indian Nation; Karuk Tribe; Quartz Valley Tribe; Yurok Tribe; Modoc Tribe of Oklahoma. The GSP details and documents including a Karuk Tribe Respresentative as part of the GSP Advisory Committee, Although there are four tribes listed as stakeholders, only the Karuk Tribe is being actvively engaged through SGMA. ",
Martha,,,Ecosystems,1,"Does the GSP document how environmental stakeholders were given opportunities to engage in the GSP development process? If so, please describe the level of engagement (e.g., whether stakeholders were on an advisory committee, GSA board, working group) in the Notes. Answer according to level of engagement: Yes = Involve, Collaborate, Empower; Somewhat = Inform and Consult; No = No mention of engagement. ","No= does not identify environmental stakeholders or documents engagement opportunies for stakeholders
Somewhat= identifies environmental users as stakeholders but does not include targetted engagement opportunities for them. Only provides details on engagement opportunities for ALL stakeholders listed. 
Yes= identifies environmental users as stakeholders, includes targetted engagement opportunities for them beyond informing them","environment, stakeholder, environmental beneficial user",Yes,"Environmental/Ecosystem Inform and involve to sustain a vital ecosystem The Nature Conservancy; CalTrout; North Groups Sierra Club; National Marine Fisheries Service; Klamath Riverkeepers; Pacific Coast Federation of Fisherman’s Associations

State Land Management or Agencies Inform, involve and collaborate to ensure basin sustainability California Department of Fish & Wildlife; California Department of Fish and
Wildlife – Shasta Valley Wildlife Area and Shasta Big Springs Ranch Wildlife Area; State Water Resources Control Board, North Coast Regional Quality Control Board

Local Organizations: At times District Board members and staff, as well as Advisory Committee members, will share information and coordinate with established community organizations such as NGO’s, irrigation districts, or localized interested parties by attending standing meetings and utilizing known communication channels. Additional coordination may occur through non-SGMA related forums, monthly information pieces in newsletters, or by disseminating information in any other manner that reaches the desired target audience.


Coordination with State and Federal Agencies: In order to ensure effective integration of distinct, yet oftentimes overlapping, water management and policy programs, the GSA will coordinate and share information, as needed, with state and federal agencies such as the California Department of Fish and Wildlife, Department of Water Resources, State Water Resources Control Board, US Fish and Wildlife Service and National Marine Fisheries Service.

Advisory Committee Meetings: The Shasta Valley Groundwater Advisory Committee will gather for six regularly scheduled meetings each year in 2019 and 2020 along with potential additional “Special Meetings” should such meetings be warranted, and on an as needed basis in  2021. The purpose of these meetings is for committee members to provide local insights, advice and recommendations during the GSP development process. The meetings also provide an important forum that enables interested parties to stay informed of SGMA activities and contribute to GSP development. Interested members of the public are encouraged to attend Advisory Committee meetings. GSA staff will keep a record of attendance, and track the various constituencies and interested parties which attend and contribute to GSP development. 


Advisory Committee Members
• Tristan Allen, Montague Water Conservation District
• Lisa Faris, Big Springs Irrigation District
• Susan Fricke (Vice-Chair), Karuk Tribe Representative
• Blair Hart, Private Pumper
• Justin Holmes, Edson-Foulke Ditch Company
• Steve Mains, Grenada Irrigation District
• Robert Moser, Municipal/City (Lake Shastina Community)
• Peter Scala, Private Pumper
• John Tannaci (Chair), Residential
• Gregg Werner, Environmental/Conservation Representative
• Justin Sandahl, Shasta River Water Users Association

","Communications & Engagement Plan Page 7, 8, 12, 15","1. Environmental Stakeholders identified? Yes
2. Which level of engagment: Collaborate
3. Evidence/strategies listed for level of engagement: Rep on board, targetted outreach for input

GSP references engaging environmental/ecosystem stakeholders by appointing an environmental/ecosystem representative as part of the Advisory Commitee as well as coordinating with local organizations and state and federal agencies that protect the environment such as the Department of Fish & Wildllife . ",
Martha,,,DACs,2,"Does the Stakeholder Communication and Engagement Plan or GSP include outreach to DACs during GSP implementation? If so, please describe the level of engagement in the Notes. Answer according to level of engagement: Yes = Involve, Collaborate, Empower; Somewhat = Inform and Consult; No = No mention of engagement.","No= does not document implementation outreach for stakeholders, does not identify DACs as stakeholders(when they are present)
Somewhat= Identifies DACs as stakeholders, outlines outreach to stakeholders (not DAC-specific)
Yes=Identifies DACs as stakeholders, includes DAC-specific outreach (beyond informing)","Disadvantaged Communit*, DAC, stakeholder, beneficial user",No,"Community Involvement
To ensure broad public awareness and involvement as the GSP is developed, the GSA has tasked Advisory Committee members to act as liaisons to educate, inform and solicit input from the wider local community throughout the collaborative process. Key meetings and milestones during the process in which the general public is encouraged to attend and provide feedback on draft GSP content or other SGMA related issues include, but are not necessarily limited to  • Bi-monthly Advisory Committee meetings when draft GSP sections are introduced, discussed or evaluated by members• Advisory Committee engagement with constituents, with support as needed from GSA staff, during related meetings, events, and discussions by members, • Stakeholder meetings led by GSA staff with participation from Advisory Committee members, Technical Consulting Team members and/or Facilitation Support Services • Public comment periods when draft GSP sections are made available for review • Regularly scheduled District Board meetings • Special meetings that are scheduled, noticed in advance and open to the public At key intervals during GSP development, the GSA will hold public meetings in order to share information, respond to questions or concerns about SGMA, and solicit input from the wider community. Interested parties can also reach out to District staff at any time to share and discuss specific elements of the GSP or SGMA in general.


Human Right to Water:Inform and involve to provide  safe and secure groundwater supplies to disadvantages communities Edgewood; Lake Shastina Community District; Siskiyou County Service Area 5 – Carrick, Gazelle and Montague

Outreach Strategies, Forums and Tools SGMA gives local GSAs wide discretion in how to conduct stakeholder communication and engagement. The Siskiyou County GSA will utilize the following outreach strategies, forums and tools to successfully meet all SGMA stakeholder engagement requirements:  Public Meetings and Workshops: Public meetings and workshops will be held as needed at key milestones or as required by SGMA. These events can target specific geographic areas or be designed to welcome constituents from across the basin. At times, public meetings may be held in different locations across Siskiyou County. GSA staff, as well as the GSA’s technical and  facilitation consultants, will help plan and facilitate these events. Advisory Committee members and the District Board may play a support role. 

Advisory Committee Meeting Announcements: Meeting agendas and handouts will be distributed to committee members and the interested parties list 72 hours prior to each meeting. Social Media: Although not currently used, Facebook, Twitter, YouTube and other emerging social media technologies may be utilized to provide SGMA updates to interested parties. Informational Materials: GSA staff, with support from both its consultants and Advisory Committee members, will jointly develop and utilize an array of informational materials to educate the public. These materials may include, but not necessarily be limited to, the following: • Local SGMA brochures and key talking points• Frequently asked questions about SGMA, the local GSA and the local GSP • Existing and new educational materials• Publicly available groundwater elevation or other related data
• Press releases, newspaper editorials and newsletter articles Website: The GSA will regularly post and archive SGMA affiliated meeting materials on the county’s established SGMA website (e.g. meeting agendas, presentations, summaries). The website will also serve as a repository for groundwater related reports, studies and other topical information discussed by the GSA or its Advisory Committees. Media: Production of public service announcements, press releases or featured articles will expand awareness of SGMA and how interested parties can get involved. At important milestones advertisements or other announcements in local newspapers will provide information about public meetings, workshops and public comment periods on draft GSP materials.

Interested Parties List: GSA staff will maintain a interested parties email list that includes anyone interested in receiving information on SGMA in Siskiyou County during GSP development and implementation. Notification for public meetings and comment periods on draft  GSP materials will be distributed through the interested parties list.",2-6 to 2-13,"1. Documents outreach plans to stakeholders? (yes/no) Somewhat
2. List specific outreach methods for DACs?  ( yes/no) NO
3. What level of outreach engagement? 

GSP did include disadvanatged communities as stakeholders iin the communications & Engagement plan, and do offer outreach and engagement materials for all stakeholders. There are no DAC-specific outreach actions. Mostly focuses on outreach during development and not so much on implementation. ",
Martha,,,Tribes,2,"Does the Stakeholder Communication and Engagement Plan or GSP include outreach to tribes during GSP implementation? If so, please describe the level of engagement (e.g., whether stakeholders were on an advisory committee, GSA board, working group) in the Notes. Answer according to level of engagement: Yes = Involve, Collaborate, Empower; Somewhat = Inform and Consult; No = No mention of engagement.","No= does not identify Tribes as stakeholder (when present or ackowledged within the basin), does not outline outreach methods
Somewhat= might/might not identify Tribes as stakeholder, or reference to Tribal members present in basin but have not Tribe-specific outreach outlined, only general stakeholder outreach 
Yes= Identifies Tribes as stakeholders, includes outreach specific for Tribal stakehodlers explicitly (beyond informing)","Tribal, tribe, stakeholder, beneficial user",Yes,"Tribal Engagement: In addition to the role that tribal representatives will play on Advisory Committees, the GSA will, as noted, maintain a government-to-government relationship with any tribe in the Siskiyou County/Klamath River watershed region that expresses interest in participating in SGMA activities. The GSA will seek to foster trust building, provide the opportunity for tribes to have meaningful involvement, and create a forum by which sovereign tribes can communicate their respective needs and interests around SGMA. As noted earlier, the GSA has utilized DWR Facilitation Support Services to help develop and maintain positive relationships with interested tribes.

Advisory Committee Members
• Tristan Allen, Montague Water Conservation District
• Lisa Faris, Big Springs Irrigation District
• Susan Fricke (Vice-Chair), Karuk Tribe Representative
• Blair Hart, Private Pumper
• Justin Holmes, Edson-Foulke Ditch Company
• Steve Mains, Grenada Irrigation District
• Robert Moser, Municipal/City (Lake Shastina Community)
• Peter Scala, Private Pumper
• John Tannaci (Chair), Residential
• Gregg Werner, Environmental/Conservation Representative
• Justin Sandahl, Shasta River Water Users Association

Tribal Engagement
To foster meaningful engagement with Native American Tribes, the GSA will maintain a government-to-government relationship with any tribe in Siskiyou County or the larger Klamath River watershed which expresses interest in SGMA. In addition, the GSA has appointed a tribal representative to the Advisory Committees for the Shasta Valley, Scott Valley and Butte Valley groundwater basins. Tribal representation on these committees is based on multiple factors,
including cultural relationship to the area, ancestral territory and land held in trust or reservation  6 within a given basin. The GSA has begun developing communication protocols and coordination agreements with tribes who have voiced interest in SGMA. Individual tribes are recognized as sovereign tribal nations; no one tribe represents another. In Shasta Valley, the Karuk Tribe is represented on the local SGMA Advisory Committee. 


Native AmericanTribes:
Inform, involve and consult
with tribal governments (See
DWR Tribal Engagement with
Tribal Guidance Document 7):
Shasta Indian Nation; Karuk Tribe;
Quartz Valley Tribe; Yurok Tribe;
Modoc Tribe of Oklahoma

The GSA maintains a government-to-government relationship with any Native American Tribe in Siskiyou County or the larger Klamath River watershed which expresses interest in SGMA. Tribal representatives have been appointed to the advisory committees in the Scott Valley, Shasta Valley and Butte Valley groundwater basins. Moreover, Siskiyou County and the Karuk Tribe formalized good faith communication protocols around SGMA through an established memorandum of understanding. ","Communications & Engagement Plan page 5,6, 8, 12, 15
1-6
1-9","1. Documents outreach plans to stakeholders? (yes/no) Yes
2. List specific outreach methods for Tribes?  (yes/no) Yes
3. What level of outreach engagement? Empower - member on the Advisory committe + MOU

GSP listed Tribes as being represnted in the Advisory Commite which will continue to meet during implementation as well as specifically keep an open line of communication to interested tribe members in the Basin. ",
