Unnamed: 0,GENERAL,Unnamed: 2,General Notes ,Unnamed: 4,Unnamed: 5,Unnamed: 6,GSP Information,Answer,Unnamed: 9,Unnamed: 10,Unnamed: 11,Unnamed: 12
,,,"SH:  Only environmental stakeholders have representation on the Advisory Committee, DACs are not mapped, the subbasin is stated to be mostly DAC but most of the language is not DAC specific. 
ISW:Good ISW assessment; Data gaps identified; the plan maps th data gaps, but does not label them pSIWs
GDE: flora and fauna were identified, as well as critical species; clear description of GDE methods; lack of clarity around the groundwater data used; GDEs removed close to ag land; 2017-2020 water year types used, no inclusion of dry year; data gpas identiied and pGDEs mapped
CC: Water budget section severely lacking; no quantifications of any budgets. 2070 CT used and stated to incorporate precip, ET, and streamflow into projected budget. Unsure how projected SY was derived (SY section incomplete; SY stated to be lower than projected budget, which itself has its own uncertainty due to lack of quantification)
SMC: Missing details and evaluations.
PMA: the PMA section is divided into two ongoing and proposed section which made navigationg much easier. 
Other: No reference to OpenET; metering ongoing/planned for new installation; water market proposed. Planned/ongoing PMAs addressed supply augmentation through education and recycling, and proposed PMA addressed demand reduction through efficiency improvements. RWQCB identified as WQ authority, with hopes of coordination mentioned briefly.",,,,GSP ID,19,,,,
,,,,,,,GSA Name,Sierra Valley Groundwater Management District GSA,,,,
,,,,,,,Subbasin Name,SIERRA VALLEY - SIERRA VALLEY,,,,
,,,,,,,Consultant,Larry Walker & Associates,,,,
,,,,,,,GSP version,Draft,,,,
,,,,,,,Acreage of GDEs per basin,11010,,,,
,,,,,,,DAC Population,1602,,,,
,,,,,,,Tribal population,,Answer NA if Tribal Population is 0 and there is no mention of tribes described in the GSP.  Answer all Tribal related questions even if tribal populations are 0 and the GSP mentions tribes in the basin.,,,
,,,,,,,Acreage of Managed Wetlands,NoData,,,,
,,,,,,,Point Contact Name,Sara,,,,
Coding Sections,GSP Plan Element,,Topic,Level,Criteria,Spectrum,Key Search Terms,Answer,Relevant Text from GSP,GSP Page / Section,Notes,
Stakeholder,PLAN AREA,,DACs,1,"Does the GSP document how DAC stakeholders were given opportunities to engage in the GSP development process? If so, please describe the level of engagement (e.g., whether stakeholders were on an advisory committee, GSA board, working group) in the Notes. Answer according to level of engagement: Yes = Involve, Collaborate, Empower; Somewhat = Inform and Consult; No = No mention of engagement. ","No = no reference to DACs, no reference to stakeholder engagement during development 
somewhat=  no specific reference to DAC engagement but lists DAC as a stakeholder, provides stakeholder engagement details 
Yes= references DACs and how they were engaged specifically during development beyond informing DACs
","Disadvantaged Communit*, DAC, stakeholder, beneficial user",Somewhat,"Public Workshops  Public workshops were held to share information and receive feedback on GSP content. These  workshops were designed to maximize opportunities for public input during key points in the GSP process. The following table recaps the workshops held during 2018, 2019 and 2021. All workshops were noticed through traditional media, social media and the Interested Parties ema

&&

2.1.5.4 Outreach Activities
To encourage active involvement of diverse social, cultural, and economic elements of the population within the basin, SVGMD uses a variety of traditional and web-based communication tools to keep stakeholders informed and engaged, including:  Print and on-line media/newspaper announcements: Mountain Messenger; Portola Reporter; Sierra Booster and www.sierraville.org  Outreach partners’ newsletters, websites, and social media accounts  GSA websites, with posting of TAC meeting minutes, materials and recordings on the SVGMD website  Interested parties email lists  Posting of public workshop flyers at local establishments  Distributing surveys using multiple formats: hard copies at workshops, posted as PDFs  and links to online versions

&&

2.1.5.3 Collaborative Planning and Public Engagement Process
As part of the technical planning approach for developing the GSP, the GSAs established a collaborative planning approach. As described in the Communication and Engagement Plan, Appendix 2-3, opportunities for public involvement featured:  convening of a Technical Advisory Committee, consisting of an array of stakeholder interests that met on a monthly basis;
 periodic Public Workshops, which provided information on planning efforts and received feedback an input from local participants;  presentations and updates at monthly SVGMD Board meetings; and  regular email communication and updates to interested parties.

&&

Stakeholder communication and engagement may be impacted by the economic status of the community. The Sierra Valley is generally considered a Disadvantaged Community (DACs) based on DWR criteria (https://gis.water.ca.gov/app/dacs/) in that the City of Loyalton and Chilcoot-Vinton and the City of Portola (nearby in Plumas County) are all classified by DWR as DACs. ",Chapter 2: 2-34 2-35 2-33 ,"1. DAC's identified? (yes/no): Specific cities within the basin were identified as being DACs including City of Loyalton and Chilcoot-Vinton and the City of Portola. 
2. If yes, which level of engagment: Engagement= Inform , consult, Involve
3. Evidence/strategies listed for level of engagement:

The GSP  lists engagement opporutnities open to all stakeholder identified. City of Loyalton and Chilcoot-Vinton and the City of Portola have all been identified as DACs. ",
Stakeholder,,,Tribes,1,"Does the GSP document how tribal stakeholders were given opportunities to engage in the GSP development process? If so, please describe the level of engagement (e.g., whether stakeholders were on an advisory committee, GSA board, working group) in the Notes. Answer according to level of engagement: Yes = Involve, Collaborate, Empower; Somewhat = Inform and Consult; No = No mention of engagement. ","No = no reference to Tribes , no reference of stakeholder engagement opportunities
Somewhat= No specific Tribe engagement described, lists Tribes as stakeholders, includes stakeholder engagement details
Yes = reference to Tribes in the Basin, documents targetted engagment opportunities for Tribal stakeholders beyond informing","Tribal, tribe, stakeholder, beneficial user",Somewhat,"Dedicated Tribal Outreach
SGMA requires GSAs to consider the interests relating to the uses and users of groundwater.  These interested parties comprise a wide range of entities including California Native American tribes (federally recognized and non-federally recognized) (WC Section 10723.2). While there are no Tribal Trust Land Tracts (U.S. Department of Interior, Bureau of Indian Affairs) within SV Subbasin boundary based on information and data published by DWR, the SV Subbasin and immediate watershed is located within California Native American traditional lands, including the Maidu, Paiute, and Washoe Tribes. A small portion of the SV Subbasin is located outside of the SVGMD boundary, but within Plumas County, and is commonly referred to as the sliver. This sliver area is the responsibility of the Plumas County GSA, is known to have significant Tribal cultural connections, is entirely comprised of federal lands owned by Plumas National Forest, and is a hydrologically important area located along the federally designated Wild and Scenic River corridor of the Middle Fork Feather River. Accordingly, Plumas County served as the lead entity for SGMA Tribal outreach.
Plumas County utilized the DWR Engagement with Tribal Governments document, which is intended to provide general guidance to GSAs regarding how and when to engage with Tribal governments. As part of DWR’s guidance document, the recommended communication and engagement procedures for Tribes starts with contacting the Native American Heritage Commission (NAHC) to identify the appropriate Tribal entities for notification and engagement outreach. Additionally, Plumas County worked with a local Native American contact and the Plumas National Forest. The NAHC was contacted by Plumas County and a list of Tribes with traditional lands or cultural places located within the SVGMD boundary, SV Subbasin boundary, and watershed boundary was provided. Those Tribes include: Estom Yumeka Maidu Tribe of the Enterprise Rancheria  Greenville Rancheria of Maidu Indians  Mooretown Rancheria of Maidu Indians  Susanville Indian Rancheria  Tsi Akim Maidu  United Auburn Indian Community of the Auburn Rancheria  Washoe Tribe of Nevada and California In addition, the following Tribes were also contacted, as they may have traditional lands or cultural places or knowledge of cultural Tribal resources within the boundaries of the SVGMD, SV Subbasin, and watershed:  Pyramid Lake Paiute Tribe  Reno-Sparks Indian Colony  Mechoopda Indian Tribe  KonKow Valley Band of Maidu  Honey Lake Maidu Communications by email, phone, and/or mail were made to these twelve Tribes to notify them of the SGMA SV Subbasin GSP planning process, to invite them to participate, and to confirm that Tribal engagement is directed by individual Tribes, with interested Tribes communicating their preferred methods of contact and pathways of engagement. For example, engagement could solely be in the form of informational updates as an interested party or could be more involved with direct participation on a committee or during meetings or while attending public workshops. Follow up with individual Tribes was conducted and tailored to the specific Tribal responses received.

&&

Outreach Steps—Phase I Plumas County will contact the Native American Heritage Commission (NAHC) to request a Native American Contacts List of Tribes with known traditional lands or cultural places located within the boundaries of the Sierra Valley Groundwater Management District, Basin Boundary, and Watershed Boundary in Plumas and Sierra counties. Plumas County will then conduct an initial communication with Tribal primary points of contact through both mail and electronic mail (email) formats to provide information on the SGMA GSP planning process and to invite and clarify Tribal interests in participating. Tribal engagement will be directed by individual Tribes, with interested Tribes communicating their preferred methods of contact and pathways of engagement. Engagement could solely be in the form of updates as an interested party or could be more involved with direct participation on a committee, at meetings, and/or during public workshops. Per DWR’s Engagement with Tribal Governments guidance document, a follow up to the Tribal primary points of contact by telephone will also be conducted by Plumas County within two weeks of the initial contact. In the event a Tribal representative cannot be contacted within a responsible timeframe, Plumas County will consult with DWR’s Office of Tribal Policy Advisor for guidance (Anecita Agustinez, DWR Tribal Policy Advisor). Following successful initial communication with the Tribes, Plumas County will facilitate the implementation of actions that may include preparation of a formal letter from the Plumas County Board of Supervisors to each of the Tribes, involvement of the District with the Tribes, development of a Joint Powers Agreement (JPA) or Memorandum of Understanding (MOU) if requesting full participation per the Water Code, and/or establishing an engagement framework.

&&

Public Workshops  Public workshops were held to share information and receive feedback on GSP content. These  workshops were designed to maximize opportunities for public input during key points in the GSP process. The following table recaps the workshops held during 2018, 2019 and 2021. All workshops were noticed through traditional media, social media and the Interested Parties ema","2-36
Appendix B, Page B-1
2-34","1. Tribes identified? (yes/no): Somwehat, identified as having cultural affiliations within the subbasin.
2. If yes, which level of engagment: Engagement=Inform, Involve, Consult
3. Evidence/strategies listed for level of engagement:
The GSP includes general stakehoolder engagement opportunities and also includes dedicated Tribal Outreach which mostly consists of communicating with Tribal representatives during GSP process. ",
Stakeholder,,,Ecosystems,1,"Does the GSP document how environmental stakeholders were given opportunities to engage in the GSP development process? If so, please describe the level of engagement (e.g., whether stakeholders were on an advisory committee, GSA board, working group) in the Notes. Answer according to level of engagement: Yes = Involve, Collaborate, Empower; Somewhat = Inform and Consult; No = No mention of engagement. ","No= does not identify environmental stakeholders or documents engagement opportunies for stakeholders
Somewhat= identifies environmental users as stakeholders but does not include targetted engagement opportunities for them. Only provides details on engagement opportunities for ALL stakeholders listed. 
Yes= identifies environmental users as stakeholders, includes targetted engagement opportunities for them beyond informing them","environment, stakeholder, environmental beneficial user",Yes,"It is proposed that the following interests, organizations, and/or individuals serve on the TAC. Membership can be updated as needed. • GSA: Sierra Valley GMD • GSA: Plumas County • Planning Partner: Feather River Land Trust • Planning Partner: Greg Hinds • Agricultural Uses: Sierra Valley RCD • Agricultural Uses: UC Cooperative Extension • Tribal Uses: TBD • Integrated Water Management: Upper Feather River IRWM • Small Water Systems: Sierra Brooks Water System, Sierraville Public Utility District • Land Uses: City of Loyalton, USFS Plumas National Forest • Economic Development: Sierra County, Plumas County • Environmental and Ecosystem Uses: Plumas Audubon Society • Water Quality: Departments of Environmental Health (Sierra Co., Plumas Co.) • Soils, Subsidence: Integrated Environmental Restoration Services • Groundwater: Sierra County Public Works • Domestic Well Users (those who rely exclusively on domestic wells for water supply)


&&

Public Workshops  Public workshops were held to share information and receive feedback on GSP content. These  workshops were designed to maximize opportunities for public input during key points in the GSP process. The following table recaps the workshops held during 2018, 2019 and 2021. All workshops were noticed through traditional media, social media and the Interested Parties ema

&&

 CA Dept. of Fish & Wildlife
 US Forest Service
 Feather River Land Trust
 Plumas Audubon
 Trout Unlimited
TAC composition, Interested parties email list, Public workshops","C-4
2-31","
1. Environmental Stakeholders identified? Yes, CA dept. of Fish& Wildlife, US Forest Service, Feaher River Land Trust, Plumas Audobon, and Trout Unlimited are identified as environmental stakeholders within the subbasin. 
2. Which level of engagment: Inform, Collaborate, Involve, Consult
3. Evidence/strategies listed for level of engagement:

Plumas Audobon is part of the Technical Advisory Committee (TAC) which helps guide the development of the GSP. Stakeholder engagement opporutnities are also included in the GSP. ", 
Stakeholder,,,DACs,2,"Does the Stakeholder Communication and Engagement Plan or GSP include outreach to DACs during GSP implementation? If so, please describe the level of engagement in the Notes. Answer according to level of engagement: Yes = Involve, Collaborate, Empower; Somewhat = Inform and Consult; No = No mention of engagement.","No= does not document implementation outreach for stakeholders, does not identify DACs as stakeholders(when they are present)
Somewhat= Identifies DACs as stakeholders, outlines outreach to stakeholders (not DAC-specific)
Yes=Identifies DACs as stakeholders, includes DAC-specific outreach (beyond informing)","Disadvantaged Communit*, DAC, stakeholder, beneficial user",Somewhat,"2.1.5.5 Informing the Public on GSP Implementation Progress
The public was kept informed on GSP development progress through progress summary presentations provided during public workshops as documented in the CE Plan and through information and documents posted on the District’s website. To keep the public informed on GSP implementation progress, information will continue to be posted on the website and updates will be provided at Board meetings. In addition, the status of projects and management actions will be included in the annual evaluation and reporting to be facilitated by SVGMD and performed. Updates and an assessment of GSP progress will be presented annually in the fall or winter subsequent to completion of the annual reports, as described in the C&E Plan. In the event of undesirable results occurring which necessitate timely implementation of management actions, notices will be distributed via the tools listed above and in accordance with the CE Plan. The Sierra Valley TAC seeks to ensure timely implementation of an expanded monitoring network and GSP projects and management actions. To support this objective, continued engagement of TAC members and Interested Parties should be maintained throughout GSP implementation. This could be achieved through a variety of means: a standing agenda item on District Board meetings to report on GSP implementation on a recurring basis (e.g., every third month), email updates using a newsletter format, ad hoc working groups to advance specific PMAs, and/or periodic GSP implementation reviews (e.g., every six months) as part of Board meetings. ",Chapter 2: 2-37 ,"1. Documents outreach plans to stakeholders? (yes/no) YES
2. List specific outreach methods for DACs?  ( yes/no). NO
3. What level of outreach engagement? 

GSP only documents outreach plan open to all stakeholders, is not specific to any group/organization. ",
Stakeholder,,,Tribes,2,"Does the Stakeholder Communication and Engagement Plan or GSP include outreach to tribes during GSP implementation? If so, please describe the level of engagement (e.g., whether stakeholders were on an advisory committee, GSA board, working group) in the Notes. Answer according to level of engagement: Yes = Involve, Collaborate, Empower; Somewhat = Inform and Consult; No = No mention of engagement.","No= does not identify Tribes as stakeholder (when present or ackowledged within the basin), does not outline outreach methods
Somewhat= might/might not identify Tribes as stakeholder, or reference to Tribal members present in basin but have not Tribe-specific outreach outlined, only general stakeholder outreach 
Yes= Identifies Tribes as stakeholders, includes outreach specific for Tribal stakehodlers explicitly (beyond informing)","Tribal, tribe, stakeholder, beneficial user",Somewhat,"2.1.5.5 Informing the Public on GSP Implementation Progress
The public was kept informed on GSP development progress through progress summary presentations provided during public workshops as documented in the CE Plan and through information and documents posted on the District’s website. To keep the public informed on GSP implementation progress, information will continue to be posted on the website and updates will be provided at Board meetings. In addition, the status of projects and management actions will be included in the annual evaluation and reporting to be facilitated by SVGMD and performed. Updates and an assessment of GSP progress will be presented annually in the fall or winter subsequent to completion of the annual reports, as described in the C&E Plan. In the event of undesirable results occurring which necessitate timely implementation of management actions, notices will be distributed via the tools listed above and in accordance with the CE Plan. The Sierra Valley TAC seeks to ensure timely implementation of an expanded monitoring network and GSP projects and management actions. To support this objective, continued engagement of TAC members and Interested Parties should be maintained throughout GSP implementation. This could be achieved through a variety of means: a standing agenda item on District Board meetings to report on GSP implementation on a recurring basis (e.g., every third month), email updates using a newsletter format, ad hoc working groups to advance specific PMAs, and/or periodic GSP implementation reviews (e.g., every six months) as part of Board meetings. ",Chapter 2: 2-37,"1. Documents outreach plans to stakeholders? (yes/no) YES
2. List specific outreach methods for Tribes?  (yes/no) NO
3. What level of outreach engagement? 

GSP only documents outreach plan open to all stakeholders, is not specific to any group/organization. ",
Stakeholder,,,Ecosystems,2,"Does the Stakeholder Communication and Engagement Plan or GSP include outreach to environmental stakeholders during GSP implementation? If so, please describe the level of engagement in the Notes. Answer according to level of engagement: Yes = Involve, Collaborate, Empower; Somewhat = Inform and Consult; No = No mention of engagement.","No=does not identify environmental users as stakeholders, does not outline outreach methods 
Somewhat=identifies environmental stakeholders, outlines only general stakeholder outreach, not specific to environmental stakeholders
Yes=Identifies environmental stakeholders, includes outreach material for env stakeholders specifically beyond informing","environment, stakeholder, environmental beneficial user",Somewhat,"""2.1.5.5 Informing the Public on GSP Implementation Progress
The public was kept informed on GSP development progress through progress summary presentations provided during public workshops as documented in the CE Plan and through information and documents posted on the District’s website. To keep the public informed on GSP implementation progress, information will continue to be posted on the website and updates will be provided at Board meetings. In addition, the status of projects and management actions will be included in the annual evaluation and reporting to be facilitated by SVGMD and performed. Updates and an assessment of GSP progress will be presented annually in the fall or winter subsequent to completion of the annual reports, as described in the C&E Plan. In the event of undesirable results occurring which necessitate timely implementation of management actions, notices will be distributed via the tools listed above and in accordance with the CE Plan. The Sierra Valley TAC seeks to ensure timely implementation of an expanded monitoring network and GSP projects and management actions. To support this objective, continued engagement of TAC members and Interested Parties should be maintained throughout GSP implementation. This could be achieved through a variety of means: a standing agenda item on District Board meetings to report on GSP implementation on a recurring basis (e.g., every third month), email updates using a newsletter format, ad hoc working groups to advance specific PMAs, and/or periodic GSP implementation reviews (e.g., every six months) as part of Board meetings. """,Chapter 2:2-37,"1. Documents outreach plans to stakeholders? (yes/no) YES
2. List specific outreach methods for Environmental stakeholders?  (yes/no) NO
3. What level of outreach engagement? 

GSP only documents outreach plan open to all stakeholders, is not specific to any group/organization. ",
Stakeholder,,,All,2,Does the GSP include a Stakeholder Communication and Engagement Plan?,"No= does not include a C&E plan
Yes= includes specific section in GSP  dedicated to Stakeholder C&E
","Stakeholder community and engagement plan, beneficial user",Yes,,Appendix 2: Stakeholder Communications & Engagement Plan,Tite: SIERRA VALLEY GROUNDWATER BASIN Stakeholder Communications & Engagement Plan,
Stakeholder,,,DACs,1,Does the GSP identify each DAC by name and location on a map? ,"No= does not identify DACs by name, does not identify DAC locations on a map
Somewhat=identifies DAC location on a map or DAC by name (one or the other, not both)
Yes=Identifies DAC location on a map and identifies them by name(re: DAC name-- in text or map))","Disadvantaged Communit*, DAC",Somewhat,Stakeholder communication and engagement may be impacted by the economic status of the community. The Sierra Valley is generally considered a Disadvantaged Community (DACs) based on DWR criteria (https://gis.water.ca.gov/app/dacs/) in that the City of Loyalton and Chilcoot-Vinton and the City of Portola (nearby in Plumas County) are all classified by DWR as DACs. ,2-30,"1. Location on the map? (yes/no) NO, DACs were not mapped on the GSP as DACs. 
2. Identified by name? (yes/no) Specific cities were identified as DACs based on the DWR Mapping tool, including City of Loyalton and Chilcoot-Vinton and the City of Portola.  
3. DAC places, tracks, or block data used in map?
DAC Places",
