GENERAL,Unnamed: 1,General Notes ,Unnamed: 3,Unnamed: 4,GSP Information,Answer,Unnamed: 7,Unnamed: 8,Unnamed: 9
,Groundwater Dependent Ecosystems (GDE),Environment,1,"Is there an inventory, map, or description of fauna (e.g., birds, fish, amphibian) and flora (e.g., plants) species or habitat types in the basin's GDEs? Please indicate in the notes if threatened and endangered species are identified in the GSP.","groundwater dependent ecosystem, groundwater-dependent ecosystem, GDE, habitat, species",Somewhat,"Furthermore, some of the plant species included in the NCCAG mapping are facultative phreatophytes, which means they will exploit a water table if it is within a reachable depth but otherwise survive on soil moisture (typically with smaller stature and greater spacing between plants). These species include red willow (Salix laevigata), which is the most common species mapped along Temescal Wash. 

The MSHCP includes mapped areas that are potential habitat for several animal species. The western edge of a very large habitat area for burrowing owl overlaps the eastern edge of the Basin. However, the owl is an upland species that is not dependent on riparian or wetland vegetation. The coastal California gnatcatcher is a bird species federally listed as threatened. Critical habitat areas delineated by the U.S. Fish and Wildlife Service that are in or near the Basin are shown in Figure 4-22. 

Animals dependent on riparian vegetation can also be considered dependent on groundwater. The Western Riverside County Multi-Species Habitat Conservation Plan (MSHCP) evaluates the presence and habitat needs of 146 species. The only ones mapped in the vicinity of the Basin are upland plants and burrowing owls, none of which are dependent on groundwater (Western Riverside County Regional Conservation Authority 2020). The federally threatened California coastal gnatcatcheris a bird species associated with sage scrub environments. The designated critical habitat areas are almost exclusively in upland areas outside the Basin. However, edges of a few mapped habitat areas border the Temescal Wash corridor (see Figure 4-20). 

","Figure 4-22 pg 4-13/ 4.9.3
Figure 4-21 pg 4-16  / 4.9.4.1
6-31 / 6.7.2.1 && Figure 4-16","The GSP mentions endangered species, but they say they are not dependant on GW in that area. 
No inventory of species provided, but some limited descriptions of fauna and flora species. Provides a map of where gnatcatchers exist in basin area. No other inventories or descriptions of other species. 
Also does not provide the mentioned MSHCP, which is the reference document for the species that are ""not groundwater dependent"". Plan includes NC dataset polygons with NDMI values from GDE pulse and a wetland map (figure 4-16 and 4-21) "
,,Environment,1,"Were GDEs in the basin identified (mapped) and described in the GSP using best available data (e.g., NC dataset, localized VegMap data)? Please describe which data were used in the Notes.","groundwater dependent ecosystem, groundwater-dependent ecosystem, GDE, NC dataset, VegMap",Somewhat,"However, older and more recent aerial photographs indicate that the vegetation has not been a permanent feature of the landscape. The figure also shows the distribution of vegetation classified as Natural Communities Commonly Associated with Groundwater (NCCAG) by The Nature Conservancy in cooperation with DWR. Based on multiple historical vegetation surveys from the early 2000s, the Nature Conservancy prepared detailed statewide mapping of NCCAG vegetation that is accessible on-line (DWR et al. 2020). The extent of NCCAG vegetation is much greater than the extent of dense riparian vegetation and includes vegetation where the water table is certainly deeper than the root zone (such as near the Corona wells). Thus, some of the vegetation in the NCCAG polygons is probably not relying on groundwater. ","Figure 4-16 / 4.9.3
4.9.4","The GSP usese NCCAG, but also discounts the data from NCCAG. Figure 4-16 is a map of NDMI (from GDE Pulse) but there is no map of GDEs.  Riparian vegetation is discussed in reference to ISWs, but not GDEs specifically. No section explicitly on GDEs, however, there is a section on riparian vegetationa and wetlands with maps of both."
,,Environment,1,Was depth-to-groundwater data from the underlying principal aquifer used to verify the NC dataset?,"groundwater dependent ecosystem, groundwater-dependent ecosystem, GDE, NC dataset, depth to groundwater",No,"However, available data are of limited use for this purpose due to insufficient geographic and vertical coverage. Available data are almost entirely from water supply wells, which are typically screened deep in the aquifer. The groundwater elevation (potentiometric head) at the depth of the well screen can be different from the true water table, which is the first zone of saturation reached when drilling down from the ground surface. Because recharge occurs at the land surface and pumping occurs at depth, deep alluvial basins such as this one typically have large downward head gradients within the aquifer system. Thus, water level information from wells can potentially underestimate the locations where the water table is shallow enough to support phreatophytic riparian vegetation. && Water levels in wells with relatively shallow depth to water declined 15 to 25 feet during 2012 to 2015, albeit unevenly in some wells.",4-11 &&4-14 / 4.9.2,"While there was depth to water data presented in GSP, it was not used to verify the dataset"
,,Environment,2,"Did the GSP avoid using any of the following criteria when deciding whether or not to remove NC dataset polygons from the final GDE map?: 1)Presence of Surface Water, 2)Distance from agricultural fields, 3)Principal aquifer was not considered main pumping aquifer, 4)Other?  If so, please specify in the Notes. ","groundwater dependent ecosystem, groundwater-dependent ecosystem, GDE, NC dataset",No,"Older historical aerial photographs show that dense riparian vegetation was not always present prior to the 1990s (that is, prior to the Google Earth imagery). Figure 4-20 shows aerial photographs taken in 1967 of a 2-mile reach of Temescal Wash in the northern part of the Bedford-Coldwater Basin. It includes the area shown in Figure 4-18 (green rectangle). There was almost no dense riparian vegetation anywhere along the Wash in 1967. Two factors probably contributed to the lack of vegetation. First, precipitation had been consistently below average since 1947 (see additional discussion in Chapter 5). Second, groundwater pumping was higher in those days to support irrigation of citrus groves (some of which are visible in the photograph). Pumping from the Bedford area averaged 3,000 acre-feet per year (AFY) during 1947 to 1967 (WEI 2015b) versus 1,800 AFY during 2015 to 2019. Both of these factors probably contributed to low surface flow and low groundwater levels, which together killed any prior dense riparian vegetation or prevented such vegetation from becoming established. In summary, the extent, density and health of riparian vegetation has been variable historically. Vegetation appears to become denser and lusher when surface flow is more abundant and groundwater levels are consistently shallow, and it dies back during droughts and when groundwater levels are low. At any given time, the extent to which riparian vegetation along some reaches of Temescal Wash is phreatophytic and therefore affected by groundwater levels is unclear. The presence of groundwater elevations that are probably within reach of phreatophyte roots, the presence of patches of dense riparian tree canopy, and the co-occurrence of groundwater declines and vegetation stress and mortality within the past decade all suggest that some vegetation is dependent on groundwater. However, other drought-related decreases in water availability could have contributed to the observed impacts on vegetation. Additional information regarding the true water table depth in the riparian zone and a more comprehensive evaluation of rainfall, irrigation, and wastewater discharge time series is needed to confirm the degree of vegetation dependence on groundwater levels. 

 && The NCCAG vegetation mapping tool also includes a wetlands map, which is reproduced here with simplified mapping categories in Figure 4-21. In the Bedford-Coldwater Basin, almost all of the wetland polygons are   ithin the Temescal Wash channel and accounted for in the preceding discussion of riparian vegetation. The wetland categories for those polygons are mostly marsh (palustrine) or riverine and characterized as   easonally flooded. Vegetation along the low-flow channel is classified as permanently or semi-permanently flooded, which a brief inspection of aerial photographs shows is clearly incorrect. A handful of small wetland polygons were mapped in upland areas west of Temescal Wash. Most are high up in the stream canyons where perennial stream flow or shallow groundwater is sustained by small amounts of groundwater inflow from the bedrock tributary areas and not affected by pumping in the main part of the Basin. Several patchestotaling 1.4 acres are midway between the wash and western Basin boundary, where regional groundwater levels are many tens of feet below the ground surface. The seasonal flooding or saturation that supportsthe wetlandtype vegetation almost certainly derives from pooled rainfall runoff or interflow rather than discharge of regional groundwater.",4-15 && 4-16 / 4.9.4,They consider flooding to remove NC dataset polygon using criteria 1 (Presence of Surface Water)  and 3 (principle aquifer was not considered main pumping aquifer)
,,Environment,2,"Were multiple water year types (e.g., wet, average, dry) of groundwater level data used to characterize groundwater conditions in the GDEs? If so, please indicate which years and water year types in the Notes.","groundwater conditions, groundwater dependent ecosystem, groundwater-dependent ecosystem, GDE, depth to groundwater, depth to water",No,"the Normalized Difference Vegetation Index (NDVI) and the Normalized Difference Moisture Index (NDMI). Both are calculated asratios ofselected visible and infrared light wavelengths. The Nature Conservancy developed a second on-line mapping tool called GDE Pulse that provides annual dry-season averages of NDVI and NDMI for each mapped NCCAG polygon for 1985-2018 to assist with the identification of groundwater dependent ecosystems (GDEs) (TNC 2020). In Figure 4-16, the polygons are color-coded by the change in NDMI from 2012 to 2015, with positive values in increasingly dark shades of green and negative values in increasingly dark shades of red. Negative values indicate stress due to desiccation. The NDVI patterns were similar to the NDMI patterns.
","4-13 / 4.3.9.5
Figure 5-1 / 5.2","They have a whole section on 5.2 regarding whole dry and wet season. however they don't cover GDE on that section.. 2012 to 2015
No water year types were used to characterize groundwater conditions in GDEs. Figure 5-1 shows water years types for precipitation but is not cross referenced to groundwater conditions and depths"
,,Environment,2,Were depth-to-groundwater measurements under GDEs corrected for land surface elevations?,"DEM, digital elevation model, land surface elevation, depth to groundwater, GDE, groundwater dependent ecosystem",No,"A second limitation of available groundwater elevation data is the sparse geographic distribution of wells with measurements. Fortunately, many wells in the Basin with water-level data are located along Temescal Wash. Figure 4-16 shows a map of the eleven wells with relatively long-term water-level records. They are clustered into five areas. The only location where the typical spring depth to water was less than 30 feet was at the north end of the Basin, near the Flagler and Corona Non-Potable wells. Hydrographs of water levels in those wells are shown in Figure 4-17. Typical spring depths to water in the five wells in that area ranged from 15 to 27 feet. Slightly farther upstream—at the TVWD wells—typical depths to water were slightly greater than 30 feet. Depth to water increases rapidly to the west of Temescal Wash. At the Corona and Station 71 wells, the typical depth to water was 80 to 200 feet.",page 4-12 / 4.9.2,They didn't use DEM or LIDAR and no mention of correcting for land surface elevations provided. Figure 4-17 presents shallow water hydrographs of groundwater elevations (MSL) but not discussed in detail under GDEs
,,Environment,2,Were data gaps identified when mapping GDEs?,"groundwater dependent ecosystem, groundwater-dependent ecosystem, GDE, data gap, shallow monitoring well, shallow aquifer",Somewhat,"Additional information regarding the true water table depth in thevriparian zone and a more comprehensive evaluation of rainfall, irrigation, and wastewater discharge time series is needed to confirm the degree of vegetation dependence on groundwater levels. 

&& As noted in Section 6.7.8, there are several data gaps related to depletions of interconnected surface water along Temescal Wash. Data gaps include lack of water level data in certain areas, lack of dedicated monitoring (vs. production) wells, lack of wells within or near the wash channel, and uncertainty regarding vertical gradients. The objective of Project 1 is to address this data gap and improve protection of a potentially groundwater-dependent ecosystem (GDE) along Temescal Wash.","8-4 / 8.6
4-15 / 4.9.3","GDEs (as riparian vegeation and wetlands) are mapped in figures 4-16 and 4-21. Data gaps are mentioned in section 8, but are not clearly in the GDE section."
,,Environment,2,"In the case of data gaps and uncertainty, were potential GDEs mapped and described in the GSP?","potential groundwater dependent ecosystem, potential GDE, potential groundwater-dependent ecosystem, data gap",No,,,There is no map of potential GDE and no descibtion of potential GDEs
,Water Budget,Ecosystems,1,"Does the GSP include water demands for native vegetation in the historic, current, and projected water budgets?","water budget, native vegetation, phreatophyte",Yes,"
5.7.2.4. Riparian Evapotranspiration, Evapotranspiration of groundwater by phreatophytic riparian vegetation is influenced by available soil moisture and by depth to the water table. Like other types of vegetation, phreatophytes use soil moisture supplied by rainfall when it is available. Any remaining evapotranspiration demand is met by drawing water from the water table. Phreatophyte use of groundwater is assumed to decrease from the maximum rate when the water table is at the land surface to zero when the water table is 20 feet or more below the ground surface. These calculations are applied at all model cells, but non-zero amounts only occur where the depth to water is commonly less than 20 feet. Aerial photographs indicate a correlation between those areas and the presence of dense, lush riparian vegetation. Riparian evapotranspiration (ET) was a relatively minor component of groundwater outflow in both MAs—averaging four percent of total outflowsfrom the Coldwater MA and 10 percent of total outflows from the Bedford MA.","
5-18 / 5.7.2.4","Evapotranspiration of phreatophytic vegetation is included in the groundwater model for the water budgets. Other than phraetophytic vegation, no specific call out of native vegetation water demands are discussed in the sections. "
,,Ecosystems,1,"Does the GSP include water demands for managed wetlands in the historic, current, and projected water budgets?","water budget, managed wetlands",Not Applicable,"Evapotranspiration of groundwater by phreatophytic riparian vegetation is influenced by available soil moisture and by depth to the water table. Like other types of vegetation, phreatophytes use soil moisture supplied by rainfall when it is available. Any remaining evapotranspiration demand is met by drawing water from the water table. Phreatophyte use of groundwater is assumed to decrease from the maximum rate when the water table is at the land surface to zero when the water table is 20 feet or more below the ground surface. These calculations are applied at all model cells, but non-zero amounts only occur where the depth to water is commonly less than 20 feet. Aerial photographs indicate a correlation between those areas and the presence of dense, lush riparian vegetation. Riparian evapotranspiration (ET) was a relatively minor component of groundwater outflow in both MAs—averaging four percent of total outflowsfrom the Coldwater MA and 10 percent of total outflows from the Bedford MA.","Table 5-4, pg 5-15 / 5-5.7 
5-1 / 5.7.2.4",Average Annual Groundwater budgets includes riparian evapotranspiration in the water budget. No mention of managed wetlands
,,Climate Change,1,"Does the GSP incorporate climate change into the projected water budget using DWR change factors or other source? If other, please specify in the Notes. If DWR change factors were used, indicate in the Notes whether the GSP use 2030 factors, 2070 factors, or both?","water budget, climate change, change factors, 2030, 2070",Yes,"5.5.3. Simulation of Future Conditions
GSP regulations §354.18(c)(3) require simulation of three future scenarios to determine their effects on water balances, yield, and sustainability indicators. For this scenario, the growth and climate change scenarios were combined, resulting in the following two scenarios: Baseline. This represents a continuation of existing land and water use patterns, imported water availability, and climate. Growth Plus Climate Change. This scenario implements anticipated changes in land use and associated water use, such as urban expansion, and anticipated effects of future climate change on  local hydrology (rainfall recharge and stream percolation) and on the availability of imported water supplies. Both the future simulations assume a constant level of development and related water
demand in the Basin. Development in the growth plus climate change simulation is not phased in over time. This is the best way to demonstrate whether 2068 land use is sustainable because it allows for assessment of the effects of variations in climactic conditions (wet and dry cycles) on groundwater conditions, avoids subjective decisions about the concurrent timing of droughts and development, and providestime for the full effect of future conditions on groundwater to become apparent
&&&
The growth plus climate change scenario incorporated anticipated effects of climate change, urban development, and associated changes in water and wastewater management. In this scenario, rainfall and reference evapotranspiration (ET0) were adjusted to 2070 conditions using monthly multipliers developed by DWR based on climate modeling studies. The multipliers were applied to historical monthly data for the 1993 to 2017 hydrologic period used in the model. DWR prepared a unique set of multipliers for each foursquare kilometer (km2 ) cell of a grid covering the entire state.",5-7 / 5.5.3.2,They have used a DWR Multiplier
,,Climate Change,1,"Does the GSP consider multiple climate scenarios (e.g., the 2070 wet and 2070 extremely dry) scenarios in the projected water budget? If there are other scenarios considered in the GSP, please specify in the Notes.","projected water budget, 2070",No,"The multipliers were applied to historical monthly data for the 1993 to 2017 hydrologic period used in the model. DWR prepared a unique set of multipliers for each foursquare kilometer (km2 ) cell of a grid 
 covering the entire state. Nine climate grid cells overlie the Basin and its tributary watershed areas. For each recharge analysis polygon in the rainfall-runoff-recharge model, multipliers from the nearest climate grid cell were used",5-7 / 5.5.3.2,Only 2070 baseline is considered. There is no mention of 2070 wet or dry
,,Climate Change,2,Does the GSP incorporate climate change into precipitation inputs for the projected water budget?,"projected water budget, precipitation, input",Yes,"The growth plus climate change scenario incorporated anticipated effects of climate change, urban development, and associated changes in water and wastewater management. In this scenario, rainfall and reference evapotranspiration (ET0) were adjusted to 2070 conditions using monthly multipliers developed by DWR based on climate modeling studies. The multipliers were applied to historical monthly data for the 1993 to 2017 hydrologic period used in the model. DWR prepared a unique set of multipliers for each foursquare kilometer (km2) cell of a grid covering the entire state. Nine climate grid cells overlie the Basin and its tributary watershed areas. For each recharge analysis polygon in the rainfall-runoff-recharge model, multipliers from the nearest climate grid cell were used. The climate in 2070 is expected to be drier and warmer than at present. 

Figure 5-3 compares average monthly precipitation and ET0 before and after applying the climate change multipliers. Simulations of irrigated turf in the rainfall-runoff-recharge model indicated that the combined effect of the warmer and drier climate will be to increase annual irrigation demand by about 10 percent.",Figure 5-3 pg 5-7 / 5.5.3.2,
,,Climate Change,2,Does the GSP incorporate climate change into evapotranspiration inputs for the projected water budget?,"projected water budget, evapotranspiration, ET, input",Yes,"In this scenario, rainfall and reference evapotranspiration (ET0) were adjusted to 2070 conditions using monthly multipliers developed by DWR based on climate modeling studies",5-7 / 5.5.3.2,
,,Climate Change,2,"Does the GSP incorporate climate change into surface water flow inputs (e.g., imported water, streamflow) for the projected water budget?","projected water budget, surface water flow, input",Yes,"In the growth plus climate change scenario, bedrock inflow and surface inflow from tributary streams along the perimeter of the Basin were re-simulated using the rainfall-runoff-recharge model to reflect the effects of urban development in some of the tributary watersheds and of climate change. Urbanization also increased surface runoff within the Basin, which was routed to small streams and Temescal Wash.","5-7 / 5.5.3.2
 Table 5-3, pg 5-11 / 5.6",
,,Climate Change,2,Does the GSP incorporate climate change into sea level inputs for the projected water budget?,"projected water budget, sea level, input",Not Applicable,"There is no monitoring for seawater intrusion and no gaging of tidal influence. The Basin is located over 20 miles inland from the Pacific Ocean, and its lowest elevations are around 1,000 feet above sea level. No risk of seawater intrusion exists in the Basin given its location and therefore no monitoring is needed.",7-5 / 7.1.3,No risk of seawater intrusion exists in the Basin given its location and therefore no monitoring is needed.
,,Climate Change,2,Does the GSP calculate a sustainable yield based on the projected water budget with climate change incorporated?,"sustainable yield, projected water budget",Yes,"""The sustainable yield is defined as the volume of pumping that the Basin can sustain without causing undesirable effects. It is not a fixed orinherent natural characteristic of a groundwater basin. Rather, it is influenced by land use activities, importation of water, wastewater and stormwater management methods, potential recharge with recycled water, and the locations of wells with respect to interconnected streams. The estimates ofsustainable yield presented in this section reflect the current status of those variables under the historical and future scenarios and evaluates whether there would be a long-term increase or decrease in basin storage if those conditions continued over a 50-year future period.""","Table 5-5, pg 5-21  / 5.9","GSP provides 3 different sustainable yields: historic, baseline (2019-2068), and growth plus climate change (2019-2068)"
