Unnamed: 0,GENERAL,Unnamed: 2,Unnamed: 3,Unnamed: 4,Unnamed: 5,Unnamed: 6,GSP Information,Answer,Unnamed: 9,Unnamed: 10,Unnamed: 11
,,,"ISW: Decent analysis - the plan used a model and did a good job, overall, of describing the data that went into the model in the appendices. Data gaps are identified. pISWs could have been better described.
GDE: Decent analysis - the plan gave a thorough description of the methods and data used to assess the NC dataset GDE polygons. The plan did not include a detailed inventory, map, or description of flora OR fauna. A good range of groundwater data used. Data gaps are identified, but pGDEs could have been better described 
GW Quality: Needs more recent data, and graphs needs to be done again, graphs are not clear.
SMC: This section has no detail and evaluation on SMC section. 
CLIMATE CHANGE: Water budget difficult to navigate; some information was found in the main GSP text, while other was found in the separate Water Budget Chapter document (not sure why that was not included with the main GSP). Basin broken down into and discussed by each management area, as well as the basin as a whole, with all 2030 and 2070 scenarios considered. 
OTHER: No mention of Open ET, well meters, or new water markets. PMA section was incredibly sparse, with minimal detail given for each PMA (in table format).
Stakeholders: No mention of DAC or Tribes anywhere in the text. Failed to provide any details if DAC and Tribe populations are not present or just not included in the plan.Environmental stakeholders are mostly written off as well. More information is needed for stakeholder engagement since no concrete Communications & Engagement plan was provided for review. ",,,,GSP ID,3,,,
,,,,,,,GSA Name,Yolo GSA,,,
,,,,,,,Subbasin Name,SACRAMENTO VALLEY - YOLO,,,
,,,,,,,Consultant,"GEI Consultants, Inc.",,,
,,,,,,,GSP version,Draft,,,
,,,,,,,Acreage of GDEs per basin,17201,,,
,,,,,,,DAC Population,87368,"42,031 from Meagan's spreadsheet",,
,,,,,,,Tribal population,50,Answer NA if Tribal Population is 0 and there is no mention of tribes described in the GSP.  Answer all Tribal related questions even if tribal populations are 0 and the GSP mentions tribes in the basin.,,
,,,,,,,Acreage of Managed Wetlands,13678,,,
,,,,,,,Point Contact Name,Sara,,,
Coding Sections,GSP Plan Element,,Topic,Level,Criteria,Spectrum,Key Search Terms,Answer,Relevant Text from GSP,GSP Page / Section,Notes
Stakeholder,PLAN AREA,,DACs,1,"Does the GSP document how DAC stakeholders were given opportunities to engage in the GSP development process? If so, please describe the level of engagement (e.g., whether stakeholders were on an advisory committee, GSA board, working group) in the Notes. Answer according to level of engagement: Yes = Involve, Collaborate, Empower; Somewhat = Inform and Consult; No = No mention of engagement. ","No = no reference to DACs, no reference to stakeholder engagement during development 
somewhat=  no specific reference to DAC engagement but lists DAC as a stakeholder, provides stakeholder engagement details 
Yes= references DACs and how they were engaged specifically during development beyond informing DACs
","Disadvantaged Communit*, DAC, stakeholder, beneficial user",No,,,"1. DAC's identified? (yes/no):
2. If yes, which level of engagment:
3. Evidence/strategies listed for level of engagement:

No mention of DAC anywhere in the GSP text. "
Stakeholder,,,Tribes,1,"Does the GSP document how tribal stakeholders were given opportunities to engage in the GSP development process? If so, please describe the level of engagement (e.g., whether stakeholders were on an advisory committee, GSA board, working group) in the Notes. Answer according to level of engagement: Yes = Involve, Collaborate, Empower; Somewhat = Inform and Consult; No = No mention of engagement. ","No = no reference to Tribes , no reference of stakeholder engagement opportunities
Somewhat= No specific Tribe engagement described, lists Tribes as stakeholders, includes stakeholder engagement details
Yes = reference to Tribes in the Basin, documents targetted engagment opportunities for Tribal stakeholders beyond informing","Tribal, tribe, stakeholder, beneficial user",No,,,"1. Tribes identified? (yes/no):
2. If yes, which level of engagment:
3. Evidence/strategies listed for level of engagement:


No mention of  Tribes or Tribal lands or the lack of Tribal lands in the Plan Area. Usually if there are no tribal lands, GSPs will mention that under federal lands and state there are no tribal lands within the plan area. Clarificaton is needed. "
Stakeholder,,,Ecosystems,1,"Does the GSP document how environmental stakeholders were given opportunities to engage in the GSP development process? If so, please describe the level of engagement (e.g., whether stakeholders were on an advisory committee, GSA board, working group) in the Notes. Answer according to level of engagement: Yes = Involve, Collaborate, Empower; Somewhat = Inform and Consult; No = No mention of engagement. ","No= does not identify environmental stakeholders or documents engagement opportunies for stakeholders
Somewhat= identifies environmental users as stakeholders but does not include targetted engagement opportunities for them. Only provides details on engagement opportunities for ALL stakeholders listed. 
Yes= identifies environmental users as stakeholders, includes targetted engagement opportunities for them beyond informing them","environment, stakeholder, environmental beneficial user",No,"Users of groundwater have been identified as landowners, agricultural operations (including farms, dairies, and  food processors), rural residents, managed and natural wetlands, commercial and industrial users, incorporated cities and communities, unincorporated communities, and State facilities. These beneficial users of groundwater have been identified as stakeholders for public outreach activities in the Subbasin.

&&

Public Engagement Opportunities In addition to routinely scheduled YSGA meetings, further outreach and engagement opportunities were conducted, which included special workshops and outreach meetings. Details of additional public engagement opportunities are included in the following section.","1-32
1-33","
1. Environmental Stakeholders identified? Managed and natural wetlands are the only listed environmental  users. No other details of orgs or grups are provided. 
2. Which level of engagment: Engagement=General Stakeholder Inform
3. Evidence/strategies listed for level of engagement:

Although the GSP has documented some engagement opportunities, I do not believe that this small section of text explaining these engagement activies are enough. The GSP does not even have a Communications & Engagement Pla to further explain. Information about environmental users and stakeholders is lacking, more detail is needed. "
Stakeholder,,,DACs,2,"Does the Stakeholder Communication and Engagement Plan or GSP include outreach to DACs during GSP implementation? If so, please describe the level of engagement in the Notes. Answer according to level of engagement: Yes = Involve, Collaborate, Empower; Somewhat = Inform and Consult; No = No mention of engagement.","No= does not document implementation outreach for stakeholders, does not identify DACs as stakeholders(when they are present)
Somewhat= Identifies DACs as stakeholders, outlines outreach to stakeholders (not DAC-specific)
Yes=Identifies DACs as stakeholders, includes DAC-specific outreach (beyond informing)","Disadvantaged Communit*, DAC, stakeholder, beneficial user",No,,,"1. Documents outreach plans to stakeholders? (yes/no)
2. List specific outreach methods for DACs?  ( yes/no)
3. What level of outreach engagement? 

No mention of DAC anywehere in the GSP text. "
Stakeholder,,,Tribes,2,"Does the Stakeholder Communication and Engagement Plan or GSP include outreach to tribes during GSP implementation? If so, please describe the level of engagement (e.g., whether stakeholders were on an advisory committee, GSA board, working group) in the Notes. Answer according to level of engagement: Yes = Involve, Collaborate, Empower; Somewhat = Inform and Consult; No = No mention of engagement.","No= does not identify Tribes as stakeholder (when present or ackowledged within the basin), does not outline outreach methods
Somewhat= might/might not identify Tribes as stakeholder, or reference to Tribal members present in basin but have not Tribe-specific outreach outlined, only general stakeholder outreach 
Yes= Identifies Tribes as stakeholders, includes outreach specific for Tribal stakehodlers explicitly (beyond informing)","Tribal, tribe, stakeholder, beneficial user",No,,,"1. Documents outreach plans to stakeholders? (yes/no)
2. List specific outreach methods for Tribes?  (yes/no)
3. What level of outreach engagement? 

No mention of Tribes or  Tribal lands or the lack of Tribal lands in the Plan Area. Usually if there are no tribal lands, GSPs will mention that under federal lands and state there are no tribal lands within the plan area. "
Stakeholder,,,Ecosystems,2,"Does the Stakeholder Communication and Engagement Plan or GSP include outreach to environmental stakeholders during GSP implementation? If so, please describe the level of engagement in the Notes. Answer according to level of engagement: Yes = Involve, Collaborate, Empower; Somewhat = Inform and Consult; No = No mention of engagement.","No=does not identify environmental users as stakeholders, does not outline outreach methods 
Somewhat=identifies environmental stakeholders, outlines only general stakeholder outreach, not specific to environmental stakeholders
Yes=Identifies environmental stakeholders, includes outreach material for env stakeholders specifically beyond informing","environment, stakeholder, environmental beneficial user",No,,,"1. Documents outreach plans to stakeholders? (yes/no)
2. List specific outreach methods for Environmental stakeholders?  (yes/no)
3. What level of outreach engagement? 

The GSP does not include any outreach plan to environmental stakeholders during GSP implementation. Only provdes VERY VAGUE plan for engagement during development. "
Stakeholder,,,All,2,Does the GSP include a Stakeholder Communication and Engagement Plan?,"No= does not include a C&E plan
Yes= includes specific section in GSP  dedicated to Stakeholder C&E
","Stakeholder community and engagement plan, beneficial user",No,,,"Does not include seperate section for Stakeholder Communications & Engagement Plan, only briefly reviews their plan in section 1.5.5."
Stakeholder,,,DACs,1,Does the GSP identify each DAC by name and location on a map? ,"No= does not identify DACs by name, does not identify DAC locations on a map
Somewhat=identifies DAC location on a map or DAC by name (one or the other, not both)
Yes=Identifies DAC location on a map and identifies them by name(re: DAC name-- in text or map))","Disadvantaged Communit*, DAC",No,,,"1. Location on the map? (yes/no)
2. Identified by name? (yes/no)
3. DAC places, tracks, or block data used in map?

No mention of DACs in GSP. "
Stakeholder,,,Tribes,1,Are tribal lands identified and mapped in the basin?,"No=does not identify Tribal lands on a map, or references in the text
Somewhat=Tribal lands are identified in text but not mapped OR Tribal lands are mapped but not identified in text
Yes=Tribal lands are identified in text and mapped","tribal, tribe",No,,,"1. Tribal lands identified? (yes/no)
2. Tribal lands mapped? (yes/no)

No mention of Tribes in Plan Area. "
Stakeholder,,,DACs,2,Does the GSP describe the size of the population in each DAC?,"No=no reference to DAC population
Somewhat= Includes a population map and references DAC seperately
Yes= DAC population is explicitly mentioned or mapped","Disadvantaged Communit*, DAC, population",No,,,"1. Does the GSP document the size of the population for each DAC?
No reference of DAC in GSP. "
Stakeholder,,,DACs,2,"Does the GSP map minimum well depth, or depth range, of domestic wells?","No= no map and no reference of well depth, depth range of domestic wells in text; 
Map of domestic wells (point or density map of DOMESTIC wells) but no depth details in map or text
Somewhat= no map but range of depths and reference to number of domestic wells
Yes= map with DOMESTIC depths (density points or data, either in text or in map)",domestic well,No,,,"1. Does the map include depth by location?
Map does not include depth by location. 
"
Stakeholder,,,DACs,2,Does the GSP map the density of domestic wells in the basin?,"No= no map of domestic wells, reference of domestic well density in text but no map provided, or no reference at all 
Yes= density map of Domestic wells
 ",domestic well,Yes,,Figure 1-7,"1. How are domestic wells mapped (density/point/none)?
Density map is used. "
WQ,,,All,,"In the Basin Setting (Groundwater Conditions - Water Quality) section of the GSP, are water quality contaminants or constituents of concern (e.g., Nitrates; Arsenic, Uranium; DBCP; 1,2,3-TCP; Chromium-6; Perchlorate; Particulate Organic Carbon (POC); Brackish water (TDS; salts)) identified and mapped (distribution or contaminant plumes) within the plan area? In the Notes, please specify which contaminants or constituents of concern are present in the basin, and whether (distribution or contaminent plume) maps and trends were provided for each. Answer Yes =  contaminants are identified, mapped, and spatial trends described in the text; Somewhat = contaminants are identified and/or mapped, but not all spatial trends of contaminants are provided; No = No contaminants are / are not identified and mapped, and no spatial trends of contaminants are provided.","no = no water quality evaluation, no mapping spatially or description of temporal trends 
somewhat = Only come COCs mapped/trends describe, don't mention data for non-COCs
 yes = COC's have been clearly stated, mapped and temporal trends described, reason for high COC's have been stated","Nitrate; Arsenic, Uranium; DBCP; 1,2,3-TCP; Chromium-6; Perchlorate; Particulate Organic Carbon (POC); Brackish water; constituents of concern (COC); water quality; Contaminants",Yes,"Salinity – Basinwide Conditions Electrical conductivity (EC) can be used to characterize salinity in Yolo Subbasin. Figure 2-25 shows the maximum recorded EC in groundwater quality monitoring wells from 2000 to 2004, collected as part of the AB 303 Groundwater Management Assistance Act Program. In the shallow groundwater zone, average EC ranges from around 480 μmhos/cm near Buckeye and Zamora, to over 1,450 μmhos/cm in the Lower Cache-Putah and Southern Sacramento River areas (YCFCWCD, 2004). High EC in the shallow zone is also observed in southern portions of the Capay Valley. Intermediate groundwater EC values are similar to the shallow zone, in the vicinity of Davis and Woodland. The deep groundwater zone, though limited to the Davis and Lower Cache- Putah areas, display lower EC values than the intermediate and shallow groundwater zones. &&&
TDS data were obtained from 603 wells, which were described in the Groundwater Quality Assessment Report ([GAR] NCWA, 2016), and are presented in Figure 2-26. The GAR provides available data as of 2014. The GAR distributions generally agree with results mentioned above, as TDS is elevated in the agricultural areas surrounding Woodland and Davis and the Capay Valley. However, these data show additional pockets of elevated TDS, including areas near Clarksburg and Knight’s Landing.Recent data (2000 to 2016) have been collected for the Central Valley Salinity Alternatives for Long-Term Sustainability database (NCWA, 2019) and display similar concentration trends to the AB 303 and GAR data discussed above. In the shallow groundwater zone, TDS is high (>1000 milligrams per liter [mg/l] or ppm) across a large portion of the eastern Subbasin, overlying West Sacramento, Davis, and Woodland. TDS values are also elevated in the Capay Valley. TDS is generally lower in the deeper groundwater zone, though patches of elevated TDS are present near Madison and north of Woodland, and concentrations in Capay Valley are uniformly above 500 mg/l.&&&
Nitrate – Basinwide Conditions Figure 2-28 shows the maximum observed nitrate concentrations in groundwater quality monitoring wells, collected from 2000 to 2004 as part of the AB 303 Groundwater Management Assistance Act Program. Nitrate (as NO3) averages in the shallow groundwater zone range from about 16 ppm near Buckeye and Zamora to 64 ppm in the Southern Sacramento River area (YCFCWCD, 2004). Nitrate poses a significant threat to human health and therefore is subject to a primary drinking water standard. The maximum contaminant level (MCL) is 45 ppm as nitrate (NO3) or 10 ppm as nitrogen (N).&&&
Boron – Basinwide Conditions Figure 2-32 and Figure 2-33 display maximum observed boron measurements in groundwater quality monitoring wells for 1951 to 2004. This compilation was part of the AB 303 Groundwater Management Assistance Act Program. Average boron concentrations for the shallow groundwater zone ranged from about 660 micrograms per liter (ug/L) in the Western Yolo area to 2,300 ug/L in the Capay Valley area. The Capay Valley has been identified as particularly high in boron, and hosts a disparate range of boron concentrations, ranging from 392 to 9,490 ug/L. The second highest average shallow boron concentration (1,600 ug/L) was present in the Lower Cache-Putah area (YCFCWCD, 2004).&&&
Arsenic – Basinwide Conditions Figure 2-34 shows arsenic data compiled for samples collected from 1951 to 2004 as part of the AB 303 Project. Although the data are limited due to high detection limits and sampling quantity, results are useful in the identification of potential arsenic trends in the Subbasin. The limitations were discussed in the full report (YCFCWCD, 2004). Maximum arsenic detection values from 1951 to 2004 are displayed on Figure 2-34. Arsenic was not typically detected in the shallow groundwater zone, while concentrations range up to 6.4 ug/L in the intermediate zone. Arsenic detections in the deep groundwater zone are slightly higher, ranging up to 10 ug/L. The distribution of arsenic across the Subbasin illustrates some possible patterns of distribution. However, the high detection limit(s) of the older analyses may have actually omitted an area(s) of naturally-occurring arsenic at very low concentrations. In general, concentrations increase from the west to the east of the Subbasin, possibly correlated with increased thickness of the Tehama formation. Historical arsenic results in the Capay Valley and Western Yolo area show mostly non-detects and low concentrations up to 2.5 ug/L. Arsenic trends relatively higher in the area between Woodland south to Davis, exhibiting a greater prevalence of values between 2.5 and 5 ug/L. Near Davis, arsenic concentrations can range from 5 to 10 ug/L.&&&
Chromium / Hexavalent Chromium – Basinwide Conditions Total chromium (chromium III and chromium VI) data were compiled for samples collected from 1951 to 2004 as part of the AB 303 Project and are displayed on Figure 2-35. While the following discussion focuses on total chromium, it should be noted that hexavalent chromium, when detected, generally occurred at lower concentrations than chromium (YCFCWCD, 2004). Historical total chromium data in the Capay Valley and Western Yolo areas were generally non-detects or up to 10 ug/L. Chromium levels were relatively high in the area between Woodland and Davis, which exhibited a greater prevalence of values between 10 and 50 ug/L. Total chromium was particularly elevated near the City of Davis, where results ranged between 25 and 50 ug/L. It is possible that chromium concentrations decrease with depth, as maximum detected chromium decreases from 71 ug/L to 31 ug/L between the intermediate and deep groundwater zones respectively. Existing data are not sufficient to pinpoint trends in chromium concentration over time. &&&
Manganese – Basinwide Conditions Maximum manganese detections were compiled for samples collected from 1951 to 2004 as part of the AB 303 Project and are displayed on Figure. The distribution of high manganese is quite scattered, with few obvious patterns present in the data (YCFCWCD, 2004). Pockets of high concentration (>0.05 mg/L) exist between West Sacramento and Davis and in the vicinity of Davis. The Western Yolo area displays elevated concentrations along Cache Creek and east of I-505 between Madison and Winters. Near the City of Davis, manganese concentration appears to increase with depth, and is especially high to the north and east of the Davis area. (YCFCWCD, 2004). Historical data are not sufficient to establish significant increasing or decreasing trends. &&& 
Selenium – Basinwide Conditions Maximum detected selenium data were compiled for samples collected from 1969 to 2004 as part of the AB 303 Project and are displayed on Figure. Relatively high detection limits were common for the older analyses so non-4 detects may have omitted an area(s) of low concentration selenium (YCFCWCD). Nevertheless, some general selenium trends can be gleaned from the data. Elevated concentrations of selenium were historically present in the lower Cache-Putah area, particularly near Davis and generally range from 10-50 ug/L. Conversely, selenium is quite low in the Capay Valley and Western Yolo areas, where concentrations range up to 10 ug/L.&&&

","Figure 2-24 thru 2-39
Table 2-10 thru 2-15
Page 2-65 /2.2.4.4
Page 2-70 / 2.2.4.4
Page 2-77 / 2.2.4.4
Page 2-80 / 2.2.4.4
Page 2-81 /2.2.4.4
Page 2-85 / 2.2.4.4
","1. Are all concerning constituents identified as COC's, Yes/No -->which ones? Yes, EC, TDS, nitrate, boron, arsenc, manganese, selenium, hexavelant chromium, (The GSP just considers, nitrate, Salinity, TDS, Boron, Hexavelant Chromium as COC's)
2. Are the COC's mapped? Yes 
3. Is there spatial trend data for all COC's? Yes
4. Are constitues which are not of concern identified? Almost all constitutes are of concern
5. Is there a data gap/ Or not enough data related COC's? No

Figures need to be regraphed for better clarification, although everything is graphed but it seems like they have been copied from other sources which has lower the resolution and quality. 
They haven't included figure number in text for Manganese (It is figure 2-36)
The graphs are for 2000 to 2016, I was wondering if they have evaluated groundwater quality more recently.


"
WQ,,,DACs,2,Does the GSP identify the water source for DACs?,"No= no mention fo DACs and their source
Somewhat= general reference to DACs, and general source reference
Yes=Explicit naming of DAC & Source","Disadvantaged Community*, DAC",No,,,No mention of DAC throughout GSP. 
