Unnamed: 0,GENERAL,Unnamed: 2,Unnamed: 3,Unnamed: 4,Unnamed: 5,Unnamed: 6,GSP Information,Answer,Unnamed: 9,Unnamed: 10,Unnamed: 11
ISW/GDE,,,Environment,2,"In the case of data gaps and uncertainty, were potential GDEs mapped and described in the GSP?","Potential GDEs are not mapped or described in plan  = no
Vague description of potential GDEs and/or no map; wrong methods for assuming non-GDEs = somewhat
Potential GDEs are clearly acknowledged and mapped. = yes","potential groundwater dependent ecosystem, potential GDE, potential groundwater-dependent ecosystem, data gap",Yes,"iGDEs that were included in the NCCAG dataset were evaluated to determine a connection to groundwater. The evaluation of these iGDEs resulted in the creation of three categories: connected, disconnected, and uncertain. The criteria utilized to determine an iGDE’s category are described below.

&& Depth to water data is limited in the Dunnigan Hills and in the southern most portion of the Yolo Subbasin. In the Dunnigan Hills, there are a handful of polygons that are uncertain due to limited data. There are 110 acres o  vegetation iGDEs that fall into this category. There are 32 acres of wetland iGDEs that fall into this category.","Page 2-113 / 2.2.7.2

&& Page 2-114 / 2.2.7.2

Figure 2-50 and 2-51","1. Is there a map AND description of pGDEs? yes - iGDEs without adequate data were labeled as ""uncertain"" in figures 2-50 and 2-51. There is not a detailed description of the uncertain GDEs, other than the brief mention of limited groundwater in the southern basin."
CC/Other,,Water Budget,Ecosystems,1,"Does the GSP include water demands for native vegetation in the historic, current, and projected water budgets?","No: No mention of evapotranspiration for the water budget
Somewhat: Numerical models that include different land cover classes in evapotranspiration 
Yes: Riparian Evapotranspiration separated out in the water budget charts or tables ","water budget, native vegetation, phreatophyte",Somewhat,Evaporation from the land surface (soil and urban land cover) and transpiration from vegetation (agriculture and native vegetation) from all catchments within the county.,Table 10 / 1.3 (water budget chapter),"1. Is the water budget made with a spreadsheet model or numerical model? Numerical (MODFLOW)
2. Is there a line for Native Veg ET in the water budget? Native veg ET not separated out from other ET
"
CC/Other,,,Ecosystems,1,"Does the GSP include water demands for managed wetlands in the historic, current, and projected water budgets?","No: No line item or description of managed wetlands’ water demands in water budgets even if wetlands are discussed in other areas of GSP. No mention of managed wetlands in GSP.  
Somewhat: Managed wetlands are part of the numerical model or spreadsheet model assumptions but not included as a separate line item
Yes: Separate line item for managed wetlands in water budgets","water budget, managed wetlands",No,"The YSGA water budget currently contains a data gap surrounding the consideration of managed wetlands. To ensure accurate consideration of managed wetlands moving forward, additional analysis and coordination will occur.",Page 4-29 / 4.11.2.3,"1. Is the water budget made with a spreadsheet model or numerical model? Numerical
2. Is there a line for Managed Wetlands in the water budget? No
"
CC/Other,,,Climate Change,1,"Does the GSP incorporate climate change into the projected water budget using DWR change factors or other source? If other, please specify in the Notes. If DWR change factors were used, indicate in the Notes whether the GSP use 2030 factors, 2070 factors, or both?","No: Climate change not incorporated into projected water budget
Somewhat: Use a different climate model other than DWR change factors but description of methodology is unclear
Yes: Climate change is incorporated and methods are clearly stated","water budget, climate change, change factors, 2030, 2070",Yes,"Future projections in the YSGA model only capture climate change projections based on climate change model simulations centered around the mid-2030’s and mid-2070’s. Five future scenarios exist in the model. Urban demand in these five scenarios is based on Urban Water Management Plan (UWMP) projections. The total urban demand is the same across the five modeled scenarios. Land use in the five future scenarios is held constant at the 2016/2018 land use values. The differences between five future modeling scenarios are driven by the effect of the climate changes impacting irrigation demand, precipitation, and surface water supply availability. The five scenarios are as follows and the cumulative and average precipitation for the Yolo Subbasin is higher in all climate projections, compared to that in the ‘Historical’ scenario:
1. ‘Future_baseline’ – urban demand increasing; irrigated crops constant; climate same as historical
2. ‘Future_2030’ – central tendency centered around 2030
3. ‘Future_2070’ – central tendency centered around 2070
4. ‘Future_2070_DEW’ – Dry-Extreme Weather
5. ‘Future_2070_WMW’ – Wetter-Moderate Warming
Additional information on the climate change portion of the model can be found in DWR’s Climate Change Data and Guidance for Use During Groundwater Sustainability Plan Development (DWR, 2018).",Page 2-129 / 2.2.8,"1. Is climate change incorporated? Yes
2. Do they use DWR change factors (climate period analysis), transitory analysis or something else (describe)? DWR Change Factors used
3. If using DWR climate change factors, do they use 2030, 2070 or both? Both 2030 and 2070"
CC/Other,,,Climate Change,1,"Does the GSP consider multiple climate scenarios (e.g., the 2070 wet and 2070 extremely dry) scenarios in the projected water budget? If there are other scenarios considered in the GSP, please specify in the Notes.","No: Only one climate scenario used
Somewhat: no somewhat for this question
Yes: Multiple climate scenarios used (wet / extremely dry) and provided in projected water budget","projected water budget, 2070",Yes,"Future projections in the YSGA model only capture climate change projections based on climate change model simulations centered around the mid-2030’s and mid-2070’s. Five future scenarios exist in the model. Urban demand in these five scenarios is based on Urban Water Management Plan (UWMP) projections. The total urban demand is the same across the five modeled scenarios. Land use in the five future scenarios is held constant at the 2016/2018 land use values. The differences between five future modeling scenarios are driven by the effect of the climate changes impacting irrigation demand, precipitation, and surface water supply availability. The five scenarios are as follows and the cumulative and average precipitation for the Yolo Subbasin is higher in all climate projections, compared to that in the ‘Historical’ scenario:
1. ‘Future_baseline’ – urban demand increasing; irrigated crops constant; climate same as historical
2. ‘Future_2030’ – central tendency centered around 2030
3. ‘Future_2070’ – central tendency centered around 2070
4. ‘Future_2070_DEW’ – Dry-Extreme Weather
5. ‘Future_2070_WMW’ – Wetter-Moderate Warming
Additional information on the climate change portion of the model can be found in DWR’s Climate Change Data and Guidance for Use During Groundwater Sustainability Plan Development (DWR, 2018).",Page 2-129 / 2.2.8,"1. If they use DWR climate change factors, which scenarios do they use? (central tendency, extreme wet, extreme dry) All scenarios considered for both 2030 and 2070
2. If other than DWR factors, which combination(s) of RCP and GCM do they use?
3. If other than DWR factors, do they use an ensemble of models or single model run?"
CC/Other,,,Climate Change,2,Does the GSP incorporate climate change into precipitation inputs for the projected water budget?,"No: Precipitation not adjusted for climate change in inputs for projected water budget
Somewhat: no somewhat for this question
Yes: Precipitation adjusted for climate change either through change factors or other model projections for the projected water budget","projected water budget, precipitation, input",Yes,"This section summarizes the data sources used in the YSGA model for the historical period, and the main assumptions for both historical and future scenarios.
Sources: Historical, modified by Climate Change factors provided by DWR",Table 6 / 1.1.3 (water budget chapter),
CC/Other,,,Climate Change,2,Does the GSP incorporate climate change into evapotranspiration inputs for the projected water budget?,"No: Evapotranspiration not adjusted for climate change in projected water budget inputs
Somewhat: no somewhat for this question
Yes: Evapotranspiration adjusted for climate change either through change factors or other model projections in projected water budgets","projected water budget, evapotranspiration, ET, input",Yes,"This section summarizes the data sources used in the YSGA model for the historical period, and the main assumptions for both historical and future scenarios.
Sources: Historical, modified by Climate Change factors provided by DWR",Table 6 / 1.1.3 (water budget chapter),
CC/Other,,,Climate Change,2,"Does the GSP incorporate climate change into surface water flow inputs (e.g., imported water, streamflow) for the projected water budget?","No: Surface water inputs are not accounted for in projected water budgets
Somewhat: CC in surface water flows, BUT imported water not adjusted 
Yes: Surface water flows adjusted for climate change (DWR change factors for spreadsheet model, modeled with adjusted precip and ET for numerical model) and if there is imported water, it is adjusted as well.","projected water budget, surface water flow, input",No,"This section summarizes the data sources used in the YSGA model for the historical period, and the main assumptions for both historical and future scenarios.
Soures: Same as historical",Table 6 / 1.1.3 (water budget chapter),"1. Is the water budget made with a numerical model or spreadsheet model? Numerical
2. If spreadsheet, are DWR surface water change factors included?
3. Is there imported water in the water budget? Is this adjusted for climate change? No
Projected surface water flows stated to be the same as historical; i.e. not adjusted for CC"
CC/Other,,,Climate Change,2,Does the GSP incorporate climate change into sea level inputs for the projected water budget?,"No: Does not mention or apply sea level rise into projected water budget though located in vicinity of coastal region
Somewhat: no somewhat for this question
Yes: Clear sea level rise projections under climate change incorporated into projected water budget","projected water budget, sea level, input",Not Applicable,"Seawater intrusion, as observed in California’s coastal aquifers, will not likely occur within the Yolo Subbasin because the ocean is over 50 miles away, farther if measured along the waterways. The southern portion of the Yolo Subbasin is located within the Sacramento-San Joaquin Delta and has been subject to salinity intrusions during the early part of the last century but not since 1944 and 1990 (DWR, 1995) and probably not thereafter due to the state management of flows through the Delta to prohibit salinity intrusion.",Page 2-54 / 2.2.3,
CC/Other,,,Climate Change,2,Does the GSP calculate a sustainable yield based on the projected water budget with climate change incorporated?,"No: Sustainable yield not provided or is not calculated based on projected water budget with climate change
Yes: Sustainable yield is calculated based on projected water budget with climate change (ranges based on different future scenarios is OK)","sustainable yield, projected water budget",No,"From the literature available for Yolo County, the closest definition to ‘sustainable yield’ is an estimate for perennial yield provided in the Yolo County groundwater investigation from 1976 (Clendenen & Associates, 1976; Scott and Scalmanini, 1975). These investigators defined ‘perennial yield’ as “the amount of water which can be pumped annually from that basin, with no net change in storage over a selected period of time”. This definition is materially the same as the SGMA definition mentioned earlier. Perennial yield for Yolo county, for the period 1963-1972, was calculated at 304.5 TAF.",Page 56 / 1.4 (water budget chapter),Sustainable yield based off estimated volume that can be pumped without changing storage rather than off of projected future water budget
WQ,SUSTAINABLE MANAGEMENT CRITERIA,Undesirable Results,Domestic,1,Does the GSP analyze direct or indirect impacts on domestic drinking wells when defining Undesirable Results for 1) Chronic Lowering of Groundwater Levels and 2) Water Quality (See line 24)?,"NO: no mention Somewhat: explicit mention of drinking water users, but not well analyzed; mention impact on one of the UR, mentioning some of the COCs. YES: clear impact on drinking water users & explanation of all COCs","domestic well, drinking water, undesirable result, groundwater levels, water quality, groundwater quality",Somewhat,"The YSGA has not established specific sustainable management criteria for water quality in the Subbasin but will rely on current and future water quality standards established for drinking water and agricultural water uses by State and county regulatory agencies. The YSGA will annually review water quality monitoring data, in collaboration with regulating agencies, to determine if water quality is being negatively affected by groundwater management activities. In the future, where significant negative impacts to water quality associated with groundwater management activities are identified, the YSGA will coordinate with stakeholders and regulatory  agencies to establish appropriate sustainable management criteria that can be used to define the occurrence of basin-wide undesirable results for specific water quality constituents. 
The list of water quality constituents of concern for the Subbasin includes: Total Dissolved Solids (TDS), Nitrate, Arsenic, Boron, and Hexavalent Chromium (VI).&&&
3.2.1.2 Potential Effects of Degraded Water Quality Section 354.26(b)(3) of the GSP Emergency Regulations requires identification of potential effects of an undesirable result for each sustainability indicator. The potential effects of undesirable results caused by degraded water quality on beneficial uses and users of groundwater may include: increased costs to treat groundwater to drinking water standards if it is to be used as a potable supply source; increased costs to blend relatively poor-quality groundwater with higher quality sources for agricultural and non-agricultural uses; limitations on viable crop types or crop yield depending on crop sensitivity and tolerance to COCs in groundwater used for irrigation; and potential reduction in “usable storage” volume of groundwater in the basin if large areas of aquifer are impacted to the point that they cannot be used to support beneficial uses and users.
","Page 3-15 / 3.2
page 3-16 / 3.2.1.2","1. Do they mention Drinking water users for UR? Yes 
2. Which URs mention Drinking Water Users? WQ
3. Are impacts to Drinking Water users well analyzed? (mention well elevation and quality impacts) No
4. Are all impacts of all COCs described? No"
Stakeholder & WQ,,,DACs,1,"Does the GSP analyze direct and indirect impacts on DACs when defining Undesirable Results for 1) Chronic Lowering of Groundwater Levels, and 2) Water Quality (see line 24)?","NO: no mention of DACs Somewhat: mention DACs, but not well analyzed Yes: impacts to DACs analyzed and described (describe impact to DAC well elevations/quality)","disadvantaged communit*, DAC, tribal, tribe, drinking water, undesirable result, groundwater levels, water quality, groundwater quality",No,,,"1. Do they mention DACs for UR? No
2. Which URs mention DACs?
3. Are impacts to DACs well analyzed?
"
Stakeholder & WQ,,,Tribes,1,"Does the GSP analyze direct and indirect impacts on Tribes when defining Undesirable Results for 1) Chronic Lowering of Groundwater Levels, 2) Water Quality (see line 24), and 3) Depletions of Interconnected Surface Waters?","NO: no mention of Tribes 
Somewhat: mention Tribes, but not well analyzed
Yes: impacts to tribes analyzed and described (describe impact to Tribal wells/elevations)","disadvantaged communit*, DAC, tribal, tribe, drinking water, undesirable result, groundwater levels, water quality, groundwater quality",No,,,"1. Do they mention Tribes for UR? No
2. Which URs mention Tribes?
3. Are impacts to Tribes well analyzed?
"
ISW/GDE & WQ,,,Ecosystems,1,"Does the GSP analyze direct and indirect impacts on GDEs when defining Undesirable Results for 1) Chronic Lowering of Groundwater Levels, 2) Water Quality, and 3) Depletions of Interconnected Surface Waters?","NO: no mention of GDEs Somewhat: mention GDEs, but not well analyzed; only for 1 or 2 URs Yes: impacts to GDEs analyzed and described ( impacts to specific species - cause and effect ecosystem, e.g. dieback, impacts to habitat)","groundwater dependent ecosystem, GDE, groundwater-dependent ecosystem, instream, environment, undesirable result, groundwater levels, water quality, groundwater quality, depletion of surface water, ISW",Somewhat,"In addition to the impact on groundwater production, the chronic lowering of groundwater levels can also impact surface water-groundwater interactions along Subbasin waterways, such as Putah and Cache creeks, and groundwater availability for GDEs.

&& The basin-wide definition of “undesirable results” for interconnected surface water is as follows: The point at which significant and unreasonable impacts to the surface waters affect the reasonable and beneficial use of those surface waters by overlying users, including associated ecosystems.","Page 3-3 / 3.3.1.2 

&& Page 3-22/23 / 3.6.1","1. Do they mention GDEs for UR? somewhat 
2. Which URs mention GDEs? Chronic lowering of groundwater levels and depletions of interconnected surface waters
3. Are impacts to GDEs well analyzed? no - only brief mentions of GDEs, no futher analysis
This is more of a No than somewhat.
"
WQ,,Minimum Thresholds,All,2,Does the GSP establish Water Quality minimum thresholds and measurable objectives for the identified constituents/contaminents identified in the plan area (see line 24)? Please identify which constituents have Minimum Thresholds and Measurable Objectives in the Notes.,No - none Somewhat - only some COCs Yes - both,"minimum threshold, water quality, groundwater quality, contaminent, constituent of concern, COC",No,,,"1. Are MT and MO set for COCs? No
2. Do they set MT and MO for all COCs? No"
WQ,,,All,2,"Are Water Quality minimum thresholds based on or within the Maximum Contaminent levels (MCLs)? Answer Yes = for identified constituents; Somewhat = for some of the identified constituents; No = none of the identified constituents; Not Applicable should never be an answer for this question. Note: Secondary MCLs are ok for TDS, sulfate, chloride, manganese, iron.",No - none Somewhat - only some COCs Yes - both,"maximum contaminent level, MCL, minimum threshold, water quality, groundwater quality, contaminent, constituent of concern, COC",No,,,"1. Are MT set at MCL level for COCs? No
2. Are all MT set at MCL level? No

"
WQ,,,Drinking Water Users,1,"Does the GSP evaluate the cumulative or indirect impacts of proposed groundwater elevation and water quality minimum thresholds on drinking water users (e.g., domestic wells, municipal water suppliers)? ",NO: no mention Somewhat: mention vaguely &/ only for one MT section YES: mention in both MT sections and use quantitative data to justify/describe,"minimum threshold, disadvantaged communit*, drinking water users, domestic, domestic wells, groundwater levels, water quality, groundwater quality",No,,,"1. Do they mention impact of groundwater elevation MT on drinking water users? No
2. Do they mention impact of water quality MT on drinking water users? No
3. Do they use quantitative data to describe the harm of crossing the MT?

"
Stakeholder & WQ,,,DACs,1,Does the GSP evaluate the cumulative or indirect impacts of proposed groundwater elevation and water quality minimum thresholds on DACs?,NO: no mention Somewhat: mention vaguely &/ only for one MT section YES: mention in both MT sections and use quantitative data to justify/describe,"minimum threshold, disadvantaged communit*, DAC, groundwater levels, water quality, groundwater quality",No,,,"1. Do they mention impact of groundwater elevation MT on DACs? No
2. Do they mention impact of water quality MT on DACs? No
3. Do they use quantitative data to describe the harm to DACs of crossing the MT?

"
Stakeholder & WQ,,,Tribes,1,"Does the GSP evaluate the cumulative or indirect impacts of proposed groundwater elevetion, ISW and water quality minimum thresholds on Tribes? ",NO: no mention Somewhat: mention vaguely &/ only for one MT section YES: mention in both MT sections and use quantitative data to justify/describe,"minimum threshold, disadvantaged communit*, DAC, tribal, tribe, groundwater levels, water quality, groundwater quality",No,,,"1. Do they mention impact of groundwater elevation MT on Tribes? No
2. Do they mention impact of water quality MT on Tribes? No
2. Do they mention impact of ISW MT on Tribes? No
4. Do they use quantitative data to describe the harm to Tribess of crossing the MT?
"
ISW/GDE & WQ,,,Ecosystems,1,Does the GSP evaluate the cumulative or indirect impacts of proposed minimum thresholds for groundwater elevations and ISW on GDEs or environmental beneficial users of surface water?,NO: no mention Somewhat: mention vaguely &/ only for one MT section YES: mention in both MT sections and use quantitative data to justify/describe,"minimum threshold, groundwater dependent ecosystem, groundwater-dependent ecosystem, GDE, environmental beneficial user, instream, groundwater levels, water quality, groundwater quality, depletion of surface water ISW",No,,,"1. Do they mention impact of groundwater elevation MT on GDEs? No
2. Do they mention impact of ISW MT on GDEs? No
3. Do they use quantitative data to describe the harm of crossing each of the MT? No
"
WQ,,Measurable Objectives,Drinking Water Users,2,Does the GSP consider Drinking Water Users when establishing water quality and groundwater elevation measurable objectives?,NO: no mention Somewhat: mention vaguely &/ only for one MO section YES: mention in both MO sections and justify/describe,"drinking water users, domestic, measurable objective, water quality, groundwater quality, contaminent, constituent of concern, COC",No,,,"1. Does the GSP mention Drinking Water Users for water quality MO? No
2. Does the GSP mention Drinking Water Users for groundwater elevation MO? No
3. Do they justify/evaluate the MOs based on Drinking Water users water needs?
"
Stakeholder & WQ,,,DACs,2,Does the GSP consider DACs when establishing water quality and groundwater elevation measurable objectives?,NO: no mention Somewhat: mention vaguely &/ only for one MO section YES: mention in both MO sections and justify/describe,"measurable objectives, disadvantaged communities, DAC",No,,,"1. Does the GSP mention DACs for groundwater elevation MO? No
2. Does the GSP mention DACs for ISW MO? No
3. Do they justify/evaluate the MOs based on DAC water needs?

"
Stakeholder & WQ,,,Tribes,2,"Does the GSP consider Tribes when establishing water quality, ISW and groundwater elevation measurable objectives?",NO: no mention Somewhat: mention vaguely &/ only for one MO section YES: mention in both MO sections and justify/describe,"measurable objectives, tribal, tribes",No,,,"1. Does the GSP mention Tribes for WQ MO? No
2. Does the GSP mention Tribes for groundwater elevation MO? No
3. Does the GSP mention Tribes for ISW MO? No
4. Do they justify/evaluate the MOs based on Tribal water needs?

"
ISW/GDE & WQ,,,Ecosystems,2,Does the GSP consider GDEs when establishing ISW and groundwater elevationmeasurable objectives?,NO: no mention Somewhat: mention vaguely &/ only for one MO section YES: mention in both MO sections and justify/describe,"measurable objectives, groundwater dependent ecosystems, environmental beneficial user",No,,,"1. Does the GSP mention GDEs for ISW MO? no
2. Does the GSP mention GDEs for groundwater elevation MO? no
3. Do they justify/evaluate the MOs based on GDE water needs? no

"
