Unnamed: 0,GENERAL,Unnamed: 2,General Notes ,Unnamed: 4,Unnamed: 5,Unnamed: 6,GSP Information,Answer,Unnamed: 9,Unnamed: 10,Unnamed: 11
ISW/GDE,,,Environment,2,Were data gaps identified when mapping ISWs?,"no data gaps identified when there is an obvious lack of data = no
1) Vague and/or confusing mention of lacking information 2) Mention of ISW data gaps in separate section in GSP. = somewhat
Clear description of where data gaps exist (temporally and spatially) in ISW section or Data Gaps Section following the assessment= yes","Interconnected surface water, ISW",Yes,"The quantity and timing of depletions of the surface water in the Lompoc Plain is complex due to the seasonality of surface flows in the Santa Ynez River. In addition, surface flows in the Lompoc Plain are managed by water rights releases from Cachuma Reservoir as regulated by the SWRCB for the Below Narrows Account (HCM Section 2a.3). The surface water leaving the WMA (entering the Pacific Ocean) is a data gap that will be addressed with installation of a gage near the estuary.",,"1. Were data gaps identified? yes
2. Were the data gaps identified in the ISW section? yes"
ISW/GDE,,,Environment,2,"In the case of data gaps and uncertainty, were streams mapped and described as potential ISWs in the GSP? If ISWs are adequately mapped and there is no uncertainty in the ISW mapping, then select ""Not Applicable"".","no description or map of potential ISWs = no
1) partial inclusion of potential ISWs 2) only a description but no map or vice versa = somewhat
All uncertainties and data gaps are clearly described and mapped temporarily and spatially= yes","Interconnected surface water, ISW, data gap",No,,,1. Is there a map AND description of pISW? no
ISW/GDE,,Groundwater Dependent Ecosystems (GDE),Environment,1,"Is there an inventory, map, or description of fauna (e.g., birds, fish, amphibian) and flora (e.g., plants) species or habitat types in the basin's GDEs? Please indicate in the notes if threatened and endangered species are identified in the GSP.","No description of flora and fauna in GDEs = no
1) lacking in either maps/description/inventory of flora and/or fauna 2) no mention of endandgered/threatened species= somewhat
Detailed inventory, maps, or description of flora AND fauna in GDEs. Also, Inclusion of any threatened and/or endangered species in the basin.= yes","groundwater dependent ecosystem, groundwater-dependent ecosystem, GDE, habitat, species",Yes,"SWRCB Order WR 2019-0148 requires additional releases from Cachuma Reservoir beyond the 2000 Biological Opinion (NMFS 2000) to protect steelhead (O. mykiss). In addition to the endangered steelhead  trout species, riparian habitat along the lower Santa Ynez River also supports a great diversity of aquatic non-fish and terrestrial wildlife species (SWRCB 2019).

&& Special species that are potentially located within the WMA are summarized here. However, species may have water demands outside of the principal aquifers. All six SGMA sustainability indicators help protect wildlife, with depletion of interconnected surface water being the SGMA indicator most closely associated with most wildlife. The U.S. Fish and Wildlife Service (USFWS) has identified wildlife habitat areas within the WMA which support threatened or endangered species. These habitats are indirectly supported by water and land use. Figure 2a.4-5 shows the locations of these habitat areas. Table 2a.4-4, below, lists the species involved.

&& The La Graciosa thistle has not been observed since 1958 within the Santa Ynez River basin, and the U.S. Fish and Wildlife Service listed the status of likely locally extirpated (U.S. Fish and Wildlife Service 2020). The unarmored three spine stickleback (Gasterosteus aculeatus williamsoni) was mapped within the Lower San Antonio creek watershed (U.S. Fish and Wildlife Service 1985; CDFW 2021), which includes the Barka Slough, and VSFB San Antonio well field in the San Antonio Creek Valley Groundwater Basin. The mapped extents partially overlap with the Burton Mesa which is a marginal portion of the WMA. California species of special concern (SSC) that are potentially within the WMA are the Southern Western Pond Turtle (Emys marmorata pallida), the Two-striped Garter Snake (Thamnophis hammondii) (CDFW 2021). The Southern Western Pond Turtleis water dependent (Rhode et al. 2019) and is near endemic and has been found within the Santa Ynez River watershed (Spinks and Shaffer 2005; CDFW 2016) in perennial stretches of the river and elsewhere likely during streamflow events. The Two-striped Garter Snake is among the most aquatic of the garter snakes and is often found in or near permanent and intermittent freshwater streams, creeks, and pools, with a range that historically has included the Santa Ynez River watershed although current presence is less certain (CDFW 2016).

&& Stream flow and subflow of the Santa Ynez River are managed by California State Water Resources Control Board (SWRCB) under WR 2019-0148 as surface water (Section 1d.5, Plan Area).81 The 2019 Central Coast Basin Plan identified beneficial uses of the Santa Ynez River that supported wildlife habitats including Warm Fresh Water Habitat (WARM), Cold Fresh Water Habitat (COLD), Commercial and Sport Fishing (COMM), and Spawning, Reproduction, and/or Early Development (SPWN).

&& The portion of the Santa Ynez River that extends from the Lompoc Narrows to the Pacific Ocean is seasonally connected with groundwater (Section 2b.6, GC). Within this stretch of the Santa Ynez River, the Natural Communities Commonly Associated with Groundwater Dataset mapped approximately Riparian Mixed Hardwood, Coast Live Oak, Willow, and seasonally flooded wetland (Figure 2a.4-4, HCM). In addition to these habitats, surface water flows in this portion of the Santa Ynez River also sustain endangered steelhead trout (Section 2a.4-6-1, HCM). Potential GDEs were screened to eliminate wetland and vegetation identified in the database that were not GDEs (Figure 2b.6-3, GC). Screening was based, in part, on hydrographs from existing monitoring wells in which the depth to groundwater has historically exceeded the 30-feet depth identified by the Nature Conservancy as representative of groundwater conditions that may sustain common phreatophytes and wetland ecosystems (Rohde et al. 2018). The resulting locations of potential GDEs, those communities that could not definitely be eliminated from the NCCAG database, are shown on Figure 3b.2-6.","Page 2b-44 / 2b.6-3

&& Page age 2a-43-44 / 2a.4-6

&& Page 2a-43 / 2a.4-6

&& Page 2a-45 / 2a.4-6-1

Page 3b-20 / 3b.2-6-1

Table 2a.4-4","1. Does the plan present the flora AND fauna in the basin's GDEs? Habitat types (in GDE section or related appendix)? yes - special status flora and fuana in the basin are described - see table 2a.4-4. Also, in section 3b.2-6-1 (ISW and GDE undesirable results), flora in the confirmed GDEs are described.
2. Does the plan acknowledge endangered/threatened/special status species in GDEs? yes"
ISW/GDE,,,Environment,1,"Were GDEs in the basin identified (mapped) and described in the GSP using best available data (e.g., NC dataset, localized VegMap data)? Please describe which data were used in the Notes.","No map of GDEs (or wetlands, riparian veg, etc.) = no
1) Map of NC dataset polygons with NDMI but no specific GDE maps, 2) Maps of GDEs but unclear data/methods used = somewhat
GSP used NC dataset or a localized vegMap to describe and map GDEs and included a clear description of methods = yes","groundwater dependent ecosystem, groundwater-dependent ecosystem, GDE, NC dataset, VegMap",Somewhat,"Based on this study by Jones and Stokes (2000), habitats along the Santa Ynez River are not currently considered vulnerable due to pumping in the Upper Aquifer, due in part to water rights releases under the SWRCB Order WR 2019-0148 for the Cachuma Project and the resulting stable groundwater levels. Moreover, as explained above, the Alluvium’s subflow is not considered groundwater as defined by SGMA

&& Additional potential GDEs have been mapped by the California Department of Water Resources, the California Department of Fish and Wildlife, and The Nature Conservancy along the tributaries of the WMA (Figure 2a.4-4, HCM), including the following: • The same tributaries north of the Lompoc Plain with identified springs, including Santa Lucia Canyon Creek, Davis Creek, Purisima Canyon Creek and Cebada Creek • Additional creeks south of the Lompoc Plain, including Lompoc Canyon, La Salle Canyon, and Sloane Canyon Creeks These potential GDEs were assessed into three categories based on the relationship to the aquifer (Figure 2b.6-3). If depth to groundwater has historically exceeded the 30-foot depth identified by the Nature Conservancy as representative of groundwater conditions that may sustain common phreatophytes and wetland ecosystems (Rohde et al. 2018), the potential GDE was identified as unlikely to be affected bygroundwater management (Category C on Figure 2b.6-3). Riparian areas of the Santa Ynez River were identified as being managed by the SWRCB as part of Santa Ynez River surface and subflow (Category B on Figure 2b.6-3). The remaining area consists of GDEs likely related to groundwater levels (Category A on Figure 2b.6-3). Table 2b.6-2 below summarizes the land areas involved.","Page 2b-45 / 2b.6-3

&& Page 2b-45 / 2b.6-3

Figure 2a.4-4
Figure 2b.6-3
Table 2b.6-2","1. Is there a map? yes, figure 2a 4-4 presents the NC Datset GDE polygons and figure 2b.6-3 presents the refined GDEs
2. Is there a description of data sources and processing (in GDE section or related appendix)? (describe in notes) somewhat - the plan uses depth to groundwater (30 feet) to identifiy where NC dataset GDEs are likely and unlikely, yet there are no details about spatial location of groundwater wells, screening depths, and figure 2b.6-3, the final GDE map, does not include groundwater elevation contours. Serious lack of groundwater description in relation to GDEs.

The plan does include groundwater elevation contours in section 2b.1-2, but did not reference these or discuss them in relation to GDEs. Only 2020 high and 2019 low groundwater elevation contour maps included in plan."
ISW/GDE,,,Environment,1,Was depth-to-groundwater data from the underlying principal aquifer used to verify the NC dataset?,"No groundwater depth data described = no
Groundwater measurements used but lack of detail in describing depth to groundwater data. Also there might be a lack of information on which aquifer the data is from. = somewhat
depth to groundwater is clearly used and description of spatial/temporal data is included = yes","groundwater dependent ecosystem, groundwater-dependent ecosystem, GDE, NC dataset, depth to groundwater",Somewhat,"These potential GDEs were assessed into three categories based on the relationship to the aquifer (Figure 2b.6-3). If depth to groundwater has historically exceeded the 30-foot depth identified by the Nature Conservancy as representative of groundwater conditions that may sustain common phreatophytes and wetland ecosystems (Rohde et al. 2018), the potential GDE was identified as unlikely to be affected bygroundwater management (Category C on Figure 2b.6-3). Riparian areas of the Santa Ynez River were identified as being managed by the SWRCB as part of Santa Ynez River surface and subflow (Category B on Figure 2b.6-3). The remaining area consists of GDEs likely related to groundwater levels (Category A on Figure 2b.6-3). Table 2b.6-2 below summarizes the land areas involved.

&& In accordance with the Sustainable Groundwater Management Act (SGMA), “groundwater elevation contour maps depicting the groundwater table or potentiometric surface associated with the current seasonal high and seasonal low for each principal aquifer within the basin”87 are to be prepared for the WMA. Contours were developed for those portions of the WMA having sufficient number and distribution of groundwater wells. Groundwater elevation contour maps for seasonal high (spring 2020) and seasonal low (fall 2019) conditions within the WMA are included as Figures 2b.1-1 and 2b.1-2.

&& Seasonal high groundwater elevations represented by Spring 2020 measurements are presented on Figure 2b.1-1. Shown on this map are the locations of wells with groundwater monitoring data, color-coded to identify wells with screened intervals within the Upper Aquifer and wells screened within the Lower Aquifer.

&& The wells shown on Figure 2b.1-3 were utilized to prepare representative hydrographs for the WMA
subareas. The colors of hydrograph data points correspond to their data source noted in the figures and
described in Section 2b.1-1, “Groundwater Elevation Data.” The hydrographs show the measured
groundwater elevation on the left y-axis (vertical axis) and the corresponding depth to groundwater on
the right y-axis. Grid lines depicting Calendar Year are provided at the top x-axis (horizontal axis) and the
bottom x-axis shows the Water Year which spans October through September, annually. Vertical columns
for the water year are colored to represent water year index based on precipitation (wet, dry/critically
dry, or above/below normal).
The following subsections discuss the hydrograph data presented in Figure 2b.1-4A-H. In general, the
hydrograph data show visible but slight increases in groundwater elevations during the relatively wet
1990-2000 period and decreases in groundwater elevations during the relatively dry 2005-2020 period.","Page 2b-45 / 2b.6-3  

&& Page 2b-5 / 2b.1-2

Page 2b-6 / 2b.1-2-1

Page 2b-8 / 2b.1-3","1. Is data from shallowest principal aquifer used? somewhat  somewhat- the 2020 and 2019 contour maps (not referenced or discussed in relation to GDEs) use groundwater data from upper and lower principal aquifer. The groundwter hydrographs have wells in both the upper and lower aquifer.
2. Is there a description of the data (in GDE section or related appendix)? (spatial, temporal, proximity to GDEs?) somewhat - there is no description of the source of the ""historic"" groundwater depths used to characterize GDEs in section 2b.6-3. In section 2b.1-2, groundwater elevation contours are discussed for 2019 and 2020. Also, groundwater hydrographs throughout the basin are presented in figures 2b.1-4AB through 2b.1-5 in the attached figures.  Screening depths and spatial location acknowledged. No details about well proximity to GDEs.

"
ISW/GDE,,,Environment,2,"Did the GSP avoid using any of the following criteria when deciding whether or not to remove NC dataset polygons from the final GDE map?: 1)Presence of Surface Water, 2)Distance from agricultural fields, 3)Principal aquifer was not considered main pumping aquifer, 4)groundwater connection % of time, 5)Other?  If so, please specify in the Notes. ","GSP uses one of the above criteria (or other illogical reason) to remove a potential GDE = no
Unclear whether or not plan used these criteria = somewhat
The GSP does not include any of these criteria to remove a NC dataset polygon = yes","groundwater dependent ecosystem, groundwater-dependent ecosystem, GDE, NC dataset",Yes,,,
ISW/GDE,,,Environment,2,"Were multiple water year types (e.g., wet, average, dry) of groundwater level data used to characterize groundwater conditions in the GDEs? If so, please indicate which years and water year types in the Notes.","Only 1 year of data or no data used to characterize gw conditions in GDE = no
The plan lacks a description of multi-year groundwater level data and/or only post-drought or post- SGMA benchmark data is used (after 2015)  = somewhat
1. Detailed explanation of the multi-year groundwater data used and 2. groundwater data from prior to recent drought = yes","groundwater conditions, groundwater dependent ecosystem, groundwater-dependent ecosystem, GDE, depth to groundwater, depth to water",Somewhat,"The following subsections discuss the hydrograph data presented in Figure 2b.1-4A-H. In general, the hydrograph data show visible but slight increases in groundwater elevations during the relatively wet 1990-2000 period and decreases in groundwater elevations during the relatively dry 2005-2020 period.",Page 2b-8 / 2b.1-3,"Note: 
water year type does not need to be explictely mentioned when groundwater data used multiple years of known wet and dry periods

The groundwater hydrographs discussed in section 2b.1-3 do include multiple water year types. This is a somewhat because there is no details about which wells and what years were specifically used to assess GDEs."
ISW/GDE,,,Environment,2,Were depth-to-groundwater measurements under GDEs corrected for land surface elevations?,"depth to water measurements interpolated from wells = no
Model is said to use groundwater elevations, but did not state that they corrected for land surface elevation = somewhat
It is explicit that groundwater measurements used to verify GDEs are correct for land surface elevation = yes","DEM, digital elevation model, land surface elevation, depth to groundwater, GDE, groundwater dependent ecosystem",No,,,"1. Was a digital elevation model (DEM) or Lidar data used to correct for land surface elevation?

no mention of DEM or Lidar used to correct for land surface elevation"
ISW/GDE,,,Environment,2,Were data gaps identified when mapping GDEs?,"No data gaps identified when there likely should be = no
Vague description of a lack of data or data gaps mentioned in other section of GSP = somewhat
Clear description of data gaps (spatial and temporal) in text and/or mapped = yes","groundwater dependent ecosystem, groundwater-dependent ecosystem, GDE, data gap, shallow monitoring well, shallow aquifer",Somewhat,"The Santa Ynez River estuary is where the Santa Ynez River meets and mixes with Pacific Ocean water. The estuary is located entirely within the boundaries of federal VSFB and is further protected by being within the Coastal Zone (Section 1d, Plan Area). Quantifying surface water flows into the estuary is identified as a data gap that the WMA GSA plans to address during the Plan Implementation (Chapter 5). The primary source of fresh water entering the estuary is surface water from the Santa Ynez River which depends on operations of the Cachuma Project. The mixture of river sediment, salinity, and other chemical constituents forms a dynamic setting that changes hourly with tides and with river flows. These physical properties are utilized by particular species of plants and animals form the basis for beneficial habitats.

&& Six active springs and seeps have been identified in the WMA including: four springs/seeps located in the Lompoc Upland; one in the Burton Mesa, and one in the Lompoc Terrace (Figure 2a.4-4). The quantity of water discharging from these six springs located within the WMA is currently a data gap.","Page 2a-46 / 2a.4-6-2

&& Page 2a-42 / 2a.4-5-1","1. Were data gaps identified? somewhat - in section 2a.4-5 Potential Groundwater Dependent Ecoystems, the plan did mention two data gaps but this was not in relation to mapping of GDEs. 
2. Were the data gaps identifed in the GDE section? yes, in section 2a.4-5. There is also another GDE section (2b.6-3), which discussed the mapping of GDEs. No data gaps were mentioned in the second section."
ISW/GDE,,,Environment,2,"In the case of data gaps and uncertainty, were potential GDEs mapped and described in the GSP?","Potential GDEs are not mapped or described in plan  = no
Vague description of potential GDEs and/or no map; wrong methods for assuming non-GDEs = somewhat
Potential GDEs are clearly acknowledged and mapped. = yes","potential groundwater dependent ecosystem, potential GDE, potential groundwater-dependent ecosystem, data gap",Yes,"These potential GDEs were assessed into three categories based on the relationship to the aquifer (Figure 2b.6-3). If depth to groundwater has historically exceeded the 30-foot depth identified by the Nature Conservancy as representative of groundwater conditions that may sustain common phreatophytes and wetland ecosystems (Rohde et al. 2018), the potential GDE was identified as unlikely to be affected bygroundwater management (Category C on Figure 2b.6-3). Riparian areas of the Santa Ynez River were identified as being managed by the SWRCB as part of Santa Ynez River surface and subflow (Category B on Figure 2b.6-3). The remaining area consists of GDEs likely related to groundwater levels (Category A on Figure 2b.6-3). Table 2b.6-2 below summarizes the land areas involved.",Page 2b-45 / 2b.6-3,1. Is there a map AND description of pGDEs? yes - brief description of pGDEs and figure 2b.6-3 presents the pGDEs
CC/Other,,Water Budget,Ecosystems,1,"Does the GSP include water demands for native vegetation in the historic, current, and projected water budgets?","No: No mention of evapotranspiration for the water budget
Somewhat: Numerical models that include different land cover classes in evapotranspiration 
Yes: Riparian Evapotranspiration separated out in the water budget charts or tables ","water budget, native vegetation, phreatophyte",Yes,"Riparian evapotranspiration was calculated using three sources to determine acreages of riparian vegetation types occurring within the WMA:
 The Natural Communities Commonly Associated with Groundwater (NCCAG) Wetland data set124
 The National Wetlands Inventory (NWI) dataset125
 An analysis of color-infrared aerial photos from 2012 (NAIP 2012) that was completed for this study by Stetson Engineers.","Page 2c-18 / 2c.1-4-4-4
Table 2c.2-6
Table 2c.3-4
Table2c.4-3","1. Is the water budget made with a spreadsheet model or numerical model? Numerical
2. Is there a line for Native Veg ET in the water budget? Yes, as Phreatophytes or Riparian Vegetation ET
"
CC/Other,,,Ecosystems,1,"Does the GSP include water demands for managed wetlands in the historic, current, and projected water budgets?","No: No line item or description of managed wetlands’ water demands in water budgets even if wetlands are discussed in other areas of GSP. No mention of managed wetlands in GSP.  
Somewhat: Managed wetlands are part of the numerical model or spreadsheet model assumptions but not included as a separate line item
Yes: Separate line item for managed wetlands in water budgets","water budget, managed wetlands",Not Applicable,,,"1. Is the water budget made with a spreadsheet model or numerical model?
2. Is there a line for Managed Wetlands in the water budget?
"
CC/Other,,,Climate Change,1,"Does the GSP incorporate climate change into the projected water budget using DWR change factors or other source? If other, please specify in the Notes. If DWR change factors were used, indicate in the Notes whether the GSP use 2030 factors, 2070 factors, or both?","No: Climate change not incorporated into projected water budget
Somewhat: Use a different climate model other than DWR change factors but description of methodology is unclear
Yes: Climate change is incorporated and methods are clearly stated","water budget, climate change, change factors, 2030, 2070",Yes,The Central Tendency scenarios are based on an average of 20 GCMs to project change in precipitation and evapotranspiration around 2030 and 2070 and used for projecting future conditions for the water budget. The Central Tendency scenarios were developed using an ensemble of climate models such that the entire probability distribution at the monthly scale was transformed to reflect the mean of the 20 climate projections (DWR 2018). The DWR data set also includes two additional simulation results for extreme climate scenarios under 2070 conditions: Drier/Extreme Warming (2070DEW) and Wetter/Moderate Warming (2070WMW). Use of the extreme scenarios in GSPs is optional.,Page 2c-46 / 2c.4-1-1,"1. Is climate change incorporated? Yes
2. Do they use DWR change factors (climate period analysis), transitory analysis or something else (describe)? DWR change factors
3. If using DWR climate change factors, do they use 2030, 2070 or both? Both 2030 and 2070"
CC/Other,,,Climate Change,1,"Does the GSP consider multiple climate scenarios (e.g., the 2070 wet and 2070 extremely dry) scenarios in the projected water budget? If there are other scenarios considered in the GSP, please specify in the Notes.","No: Only one climate scenario used
Somewhat: no somewhat for this question
Yes: Multiple climate scenarios used (wet / extremely dry) and provided in projected water budget","projected water budget, 2070",No,The Central Tendency scenarios are based on an average of 20 GCMs to project change in precipitation and evapotranspiration around 2030 and 2070 and used for projecting future conditions for the water budget. The Central Tendency scenarios were developed using an ensemble of climate models such that the entire probability distribution at the monthly scale was transformed to reflect the mean of the 20 climate projections131 (DWR 2018). The DWR data set also includes two additional simulation results for extreme climate scenarios under 2070 conditions: Drier/Extreme Warming (2070DEW) and Wetter/Moderate Warming (2070WMW). Use of the extreme scenarios in GSPs is optional.,Page 2c-46 / 2c.4-1-1,"1. If they use DWR climate change factors, which scenarios do they use? (central tendency, extreme wet, extreme dry) Only Central Tendency for both 2030 and 2070
2. If other than DWR factors, which combination(s) of RCP and GCM do they use?
3. If other than DWR factors, do they use an ensemble of models or single model run?"
